arquivo,estilo_real,estilo_llm,justificativa,elementos
rock_Abyssal Devourer.mp3,rock,rock,"A música apresenta riffs de guitarra elétrica pesados e distorcidos, bateria com ritmo rápido e uso proeminente de bumbo duplo, baixo marcante e vocais masculinos agressivos e guturais, características típicas do rock pesado, especificamente do metal. A 'vibe' é de alta energia e intensidade.","Guitarra elétrica distorcida com riffs pesados, Bateria com ritmo rápido e intenso, incluindo uso de bumbo duplo, Baixo com presença marcante, Vocais masculinos guturais e gritados, Solo de guitarra elétrico"
mpb_Caminho das Estrelas (1).mp3,mpb,mpb,"A música apresenta uma melodia suave e introspectiva, dominada pelo violão acústico e uma voz masculina calma. O ritmo lento e a harmonia rica, em conjunto com a atmosfera contemplativa e as letras poéticas, são características marcantes da Música Popular Brasileira (MPB), que abrange canções autorais com foco na letra e arranjos mais orgânicos.","violão acústico, voz masculina suave, baixo melódico, percussão minimalista (brushes/shaker), atmosfera introspectiva e calma"
carimbo_Amor no Balançar (1).mp3,carimbo,forró,"A música apresenta a sanfona (acordeon) como instrumento principal, ditando a melodia e harmonia, acompanhada por uma percussão marcante e um baixo que cria um ritmo dançante característico do xote, um subgênero do forró. O saxofone complementa a melodia, reforçando a sonoridade típica do Nordeste brasileiro. A 'vibe' é festiva e romântica, alinhada com as canções do gênero.","sanfona (acordeon), saxofone, baixo, bateria com ritmo de xote, percussão, vocais em português"
rock_Ecos do Caos.mp3,rock,rock,"A música apresenta guitarras elétricas fortemente distorcidas com riffs e power chords, uma bateria com batidas rápidas e marcantes, baixo proeminente e vocais intensos. Esses são elementos característicos do rock, especialmente suas vertentes mais pesadas, como o hard rock ou heavy metal.","guitarras elétricas distorcidas, bateria com batida pesada e rápida, baixo proeminente, vocais intensos, riffs de guitarra potentes"
carimbo_2Gira do Curimbó.mp3,carimbo,carimbo,"A música apresenta um ritmo percussivo forte e contagiante, com destaque para a guitarra acústica e vocais femininos. A letra faz menção explícita a 'Curimbó' e 'Pará', elementos centrais do gênero carimbó, uma dança e estilo musical tradicional originário do estado do Pará, na região Norte do Brasil. A 'vibe' é festiva e comunitária, características marcantes do carimbó.","violão acústico, percussão (tambor, curimbó, chocalhos), baixo elétrico, vocal feminino principal, vocais de apoio, ritmo dançante e tribal"
rock_Abismo da Eternidade.mp3,rock,rock,"A música apresenta guitarras elétricas fortemente distorcidas, bateria rápida e poderosa, baixo proeminente e vocais guturais e agressivos, características marcantes do heavy metal, um subgênero do rock que enfatiza a intensidade e a sonoridade pesada.","guitarras elétricas distorcidas, bateria com ritmo intenso e rápido, baixo pulsante, vocais guturais/agressivos"
rock_Fragmentos do Amanhã (1).mp3,rock,rock,"A música apresenta guitarras elétricas proeminentes, tanto com riffs limpos e melancólicos quanto com distorção e power chords. A bateria é marcante, com um ritmo pulsante e enérgico, e o baixo fornece uma base sólida. Os vocais são fortes e expressivos, complementando a sonoridade característica do rock, com uma construção dinâmica que cresce em intensidade.","guitarra elétrica (limpa e distorcida), baixo elétrico, bateria, vocal masculino"
carimbo_Amor no Balançar.mp3,carimbo,mpb,"A música apresenta um violão acústico como base, uma flauta melódica e percussão leve, com um ritmo suave e uma 'vibe' introspectiva e poética, elementos característicos da Música Popular Brasileira. A harmonia e a melodia vocal também reforçam a identidade do gênero.","violão acústico, flauta, percussão leve (possivelmente pandeiro/cajón), vocal masculino melódico em português, ritmo suave e cadenciado"
rock_2At Least.mp3,rock,rock,"A música apresenta guitarras elétricas com efeitos de overdrive e distorção, bateria com batidas fortes e marcantes, e uma linha de baixo que sustenta a melodia. A estrutura da canção, a energia vocal e a instrumentação são características típicas do rock, especialmente do rock alternativo ou indie rock.","guitarras elétricas (limpas e distorcidas), bateria com ritmo marcante e batidas fortes, baixo proeminente, vocal melódico e expressivo, progressão de acordes e arranjos típicos de rock"
carimbo_2Dança da Maré.mp3,carimbo,carimbo,"A música apresenta uma instrumentação característica com percussão marcante, incluindo o curimbó (mencionado explicitamente na letra), maracás e flauta, que são elementos fundamentais do carimbó. O ritmo é contagiante, dançante e evoca a cultura amazônica, especialmente do Pará, onde o estilo é predominante. A vibração geral é festiva e alegre, típica do gênero.","percussão (curimbó e maracás), flauta, violão, baixo, vocal feminino, coro, ritmo dançante e sincopado"
carimbo_2Dança da Chama.mp3,carimbo,forró,"A música apresenta um ritmo contagiante e dançante, com o uso proeminente de um sintetizador que emula a sanfona, um instrumento fundamental no forró. A linha de baixo é marcante e a guitarra elétrica complementa a melodia com frases rítmicas características do estilo, especialmente do forró eletrônico e universitário. Os vocais e a energia festiva reforçam a identidade do gênero.","sanfona (sintetizador), guitarra elétrica, baixo elétrico, bateria, vocais femininos, coro"
carimbo_2Dançando na Beira do Rio.mp3,carimbo,forró,"A música apresenta um ritmo binário e dançante, com forte presença do acordeão (sanfona) ditando a melodia e harmonia. A percussão com som de zabumba, triângulo e caixa é marcante, criando uma atmosfera festiva e típica do forró pé de serra.","acordeão (sanfona), percussão (com som de zabumba, triângulo e caixa), baixo elétrico, guitarra, vocal masculino e feminino (em coro), ritmo sincopado"
mpb_Caminho de Luz.mp3,mpb,mpb,"A música apresenta um arranjo acústico suave, com violão dedilhado, baixo, percussão leve e a inclusão de cordas e flauta, criando uma atmosfera introspectiva e melódica. A voz masculina transmite uma sensação de calma e poesia, elementos fortes da Música Popular Brasileira, que valoriza a complexidade harmônica e a profundidade lírica.","voz masculina, violão (dedilhado), baixo, percussão leve (shaker, vassourinha), cordas (violoncelo), flauta"
rock_2Paixão em Ruínas.mp3,rock,rock,"A música apresenta guitarras elétricas (limpas e distorcidas), um baixo e bateria com ritmo forte e constante, além de um vocal masculino expressivo. A estrutura da canção, incluindo a presença de um solo de guitarra e a energia geral, são características clássicas do rock.","guitarra acústica, guitarra elétrica distorcida, baixo, bateria, voz masculina, ritmo marcante, solo de guitarra"
mpb_Caminho de Luz (2).mp3,mpb,mpb,"A música apresenta violão acústico como base harmônica e rítmica, vocal masculino calmo e melódico, e arranjos sutis de cordas, como violino, que adicionam profundidade. A melodia é suave e introspectiva, com letras poéticas em português. Essa combinação é muito característica da MPB, que valoriza a instrumentação acústica, a expressividade vocal e a profundidade lírica, criando uma atmosfera contemplativa.","violão acústico (fingerstyle), voz masculina suave e melódica, cordas (violino/cello), percussão suave (efeito de shaker ou vassourinha)"
carimbo_2No Embalo do Carimbó (1).mp3,carimbo,carimbo,"A música apresenta um ritmo percussivo marcante, com destaque para o tambor (tambo) e maracá, violão acústico e vocais em estilo de ""chamada e resposta"". A letra faz referência explícita ao ""carimbó"" e a elementos culturais da região Norte do Brasil (açaizal, manguezal), características inconfundíveis desse estilo musical paraense.","percussão com tambo e maraca, violão acústico, vocal masculino principal com backing vocals em coro, ritmo dançante e sincopado, letras que mencionam 'carimbó' e elementos regionais"
rock_Labirinto da Mente.mp3,rock,rock,"A música apresenta guitarras elétricas (limpas no início e depois distorcidas), uma bateria marcante com ritmo forte e consistente, e vocais masculinos com entrega enérgica, que são características proeminentes do gênero rock. A 'vibe' da música, que transita de um tom mais melancólico para um mais intenso e potente, reforça essa identificação.","guitarra elétrica (limpa e distorcida), baixo, bateria com batida forte, vocais masculinos"
mpb_Batida Urbana.mp3,mpb,mpb,"A música apresenta violão acústico, um baixo suave e uma percussão leve com ritmo de bossa nova/samba. Os vocais femininos são melódicos e a harmonia é sofisticada, criando uma atmosfera relaxante e contemplativa. A sonoridade, a execução e as referências líricas ao Brasil (como 'Carnival drums' e 'Brazil') são características marcantes da MPB, que frequentemente incorpora e refina elementos do samba e da bossa nova.","violão acústico (dedilhado e com acordes), baixo elétrico, bateria com percussão leve (ritmo de bossa nova/samba, possivelmente com vassourinhas), vocal feminino suave e melódico, vocais de apoio harmonizados, pads/teclados sutis, letras em inglês com temática brasileira"
carimbo_Dança da Alegria (1).mp3,carimbo,carimbo,"A música apresenta um ritmo percussivo forte e contagiante, com destaque para a flauta e vocais vibrantes. Os instrumentos e o ritmo são característicos do carimbó. Além disso, a letra menciona explicitamente 'dança do carimbó' e 'curimbó', confirmando o estilo.","Percussão marcante (curimbó, tamborim, maracas), Melodia de flauta proeminente, Vocal masculino enérgico, Ritmo dançante e festivo, Menção explícita ao 'carimbó' e 'curimbó' na letra"
carimbo_3Dança da Floresta.mp3,carimbo,carimbo,"A música apresenta um ritmo contagiante e dançante, com uma percussão marcante que inclui tambores, junto a elementos como violão e voz feminina. A vibe é festiva e regional, sendo reforçada pela menção explícita do termo 'carimbó' na letra, além de 'dança da floresta', que são características desse estilo musical e dança típica da região amazônica do Brasil (Pará).","percussão vibrante (tambores e outros instrumentos de percussão), ritmo dançante e repetitivo, violão/cavaquinho, voz feminina melódica, sensação de festa e tradição popular, acordeão"
carimbo_2Dança da Floresta.mp3,carimbo,carimbo,"A música apresenta um ritmo vibrante e contagiante, impulsionado pela sanfona, percussão marcante e a presença de instrumentos característicos como maracas e flauta. A estrutura melódica e rítmica, juntamente com a letra que faz referência direta ao 'curimbó' e ao próprio 'carimbó', confirmam o estilo de origem amazônica, com forte apelo à dança.","sanfona (acordeon), percussão (maracas, tambores/curimbó, pandeiro), baixo, flauta, banjo (ou cavaco), voz masculina"
rock_Eterna Noite de Sangue (1).mp3,rock,rock,"A música apresenta guitarras com distorção pesada, bateria com ritmo acelerado e técnica de bumbo duplo, baixo marcante e vocais guturais, características que definem o gênero heavy metal, uma vertente do rock.","guitarras elétricas distorcidas, bateria com ritmo acelerado e bumbo duplo, baixo proeminente, vocais guturais/gritados, riffs agressivos"
rock_Saudade que Grita.mp3,rock,rock,"A música apresenta guitarras elétricas com seções limpas e distorcidas, bateria dinâmica com viradas e batidas fortes, baixo marcante e vocais masculinos emotivos que variam de melancólicos a gritados. As transições de intensidade, com a construção gradual até um clímax poderoso, são características marcantes do rock, com elementos que remetem ao alternative rock ou post-grunge.","guitarra elétrica limpa, guitarra elétrica distorcida, baixo, bateria (kick, snare, hi-hat, crash), vocais masculinos emotivos (cantado e gritado), reverb/delay"
carimbo_2Rainha do Carimbó.mp3,carimbo,carimbo,"A música apresenta um ritmo contagiante e dançante, com forte presença de percussão (como maracas e pandeiro) e um violão com sonoridade regional. A letra, que menciona repetidamente a 'Rainha do Carimbó', explicitamente identifica o gênero. A ""vibe"" é festiva e alegre, características marcantes do carimbó, um estilo musical paraense.","percussão com maraca e pandeiro, ritmo sincopado e dançante, melodia de violão com influência regional, vocais em português com a temática ""carimbó"""
rock_Fragmentos do Amanhã.mp3,rock,rock,"A música apresenta guitarras elétricas com distorção, bateria com ritmo marcante e vocal masculino energético, elementos característicos do rock.","guitarra elétrica distorcida, bateria com batida forte, baixo, vocal masculino"
rock_Ecos do Caos (1).mp3,rock,rock,"A música apresenta guitarras elétricas pesadas e distorcidas, uma bateria com batidas fortes e viradas marcantes (incluindo bumbo duplo), um baixo proeminente e vocais masculinos potentes e agressivos, características inequívocas do gênero rock, mais especificamente hard rock ou heavy metal.","guitarras elétricas distorcidas, bateria com bumbo duplo, baixo marcante, vocais masculinos potentes e agressivos, ritmo acelerado e energético"
sertanejo_Coração em Ruínas (1).mp3,sertanejo,forró,"A música apresenta uma melodia melancólica e emotiva, com destaque para a sanfona (acordeão) como instrumento principal, acompanhada por violão acústico e uma voz feminina expressiva. O ritmo, embora em compasso lento, possui a cadência e a instrumentação características do forró-canção ou forró romântico, explorando temas de saudade e heartbreak, que são comuns no gênero.","voz feminina, violão acústico, sanfona (acordeão), percussão suave"
mpb_Caminho de Sol (1).mp3,mpb,mpb,"A música apresenta uma sonoridade acústica e melodiosa, com a guitarra como instrumento principal, acompanhada por baixo, bateria com vassourinhas e sutis arranjos de cordas e teclado. A voz feminina é suave e expressiva, e o ritmo é calmo e envolvente, características marcantes da MPB, que valoriza a poesia, a melodia e a harmonia.","violão acústico (dedilhado e com acordes), baixo melódico, bateria com vassourinhas (ritmo suave), vocal feminino suave e expressivo, arranjo de cordas (pad), teclado/piano elétrico suave, percussão leve (chocalho/tamborim)"
carimbo_Dança da Alegria.mp3,carimbo,carimbo,"A música apresenta um ritmo contagiante e tribal, com percussão marcante (incluindo o 'curimbó' mencionado na letra), baixo pulsante e melodia festiva. A letra faz referência explícita à 'dança do carimbó', um gênero musical e de dança de origem paraense, que se encaixa perfeitamente na sonoridade apresentada.","bateria com ritmo forte e sincopado, baixo marcante, percussão (curimbó, chocalhos), guitarra/violão com levada rítmica, instrumento de sopro melódico (flauta/sax), vocalista principal e coro, atmosfera festiva e dançante"
carimbo_Dança do Vento.mp3,carimbo,carimbo,"A música apresenta uma melodia marcante e dançante impulsionada pelo acordeão, acompanhada por uma percussão vibrante e envolvente. A presença de saxofone e flauta contribui para o colorido sonoro, enquanto o ritmo é forte e convidativo à dança. As letras mencionam explicitamente o 'carimbó', solidificando a identificação com este estilo musical típico do Pará.","acordeão proeminente, percussão marcante, ritmo dançante e alegre, saxofone e flauta nas melodias, letras que mencionam 'carimbó'"
carimbo_Dança da Maré (1).mp3,carimbo,carimbo,"A música apresenta uma percussão marcante com maraca e outros instrumentos regionais (além da menção explícita ao 'curimbó' na letra), um violão base, flauta melódica e vocais vibrantes. O ritmo é contagiante e dançante, com uma cadência típica do carimbó. A vibe é festiva e alegre, remetendo diretamente às tradições culturais do Pará.","maraca, curimbó (mencionado na letra e presente na percussão), flauta, violão, percussão tribal/regional, vocais animados"
carimbo_Dance in the Sand.mp3,carimbo,rock,"A música apresenta uma instrumentação clássica de rock, com guitarras elétricas proeminentes, um baixo marcante e uma bateria com batida constante e energizada. A melodia vocal e a 'vibe' descontraída, mas com um ritmo impulsionador, se encaixam perfeitamente no gênero rock, especialmente no subgênero surf rock ou pop-rock com influências litorâneas.","guitarra elétrica com timbre limpo e rítmico, baixo com linha melódica e groove, bateria com batida 4/4 constante e marcada, vocal masculino principal claro e melódico, backing vocals harmoniosos"
carimbo_Beleza da Morena.mp3,carimbo,carimbo,"A música apresenta uma sonoridade marcante do Pará, com o acordeon (sanfona) ditando a melodia e um ritmo percussivo contagiante e dançante, característico do Carimbó. A letra faz menção explícita ao próprio estilo, ""O Carimbó te embala"".","acordeon (sanfona), percussão (incluindo maracás e pandeiro), violão, baixo elétrico, voz masculina (principal e backing vocals), ritmo alegre e sincopado"
rock_Grito da Escuridão.mp3,rock,rock,"A música apresenta guitarras elétricas com distorção pesada, bateria rápida e com uso proeminente de bumbo duplo, baixo potente e vocais masculinos agressivos e guturais. A estrutura e a intensidade sonora são características marcantes do rock, especialmente de suas vertentes mais pesadas como o heavy metal.","guitarras elétricas com distorção pesada, bateria rápida com bumbo duplo, baixo marcante, vocais masculinos agressivos/guturais, riffs de guitarra rápidos e técnicos, mudanças de ritmo e dinâmicas intensas"
rock_Metamorfose Silenciosa.mp3,rock,rock,"A música apresenta instrumentação típica de rock, com guitarras elétricas proeminentes, baixo e bateria. A estrutura da canção, a progressão melódica e a dinâmica entre versos mais introspectivos e refrões mais expansivos reforçam a identificação com o gênero.","guitarra elétrica, baixo, bateria, vocais masculinos, sintetizador"
carimbo_Dança da Maré.mp3,carimbo,carimbo,"A música apresenta um ritmo contagiante e dançante, com forte presença de percussão (incluindo o curimbó e o maracá, mencionados nas letras), guitarra elétrica com riffs vibrantes e uma melodia vocal que evoca celebração. A sonoridade, a menção de instrumentos típicos e a atmosfera festiva são características marcantes do carimbó, gênero musical paraense.","Guitarra elétrica com timbre vibrante e ritmo sincopado, Baixo elétrico com linha melódica e rítmica marcante, Percussão energética (curimbó, maracá e bateria com batida dançante), Vocal masculino principal e coros que remetem a um chamado ou celebração, Ritmo acelerado e alegre, típico de dança"
carimbo_Dança da Floresta (1).mp3,carimbo,carimbo,"A música apresenta um ritmo contagiante e dançante, com uma percussão marcante, incluindo um surdo e chocalho, e a presença proeminente do acordeão. As letras mencionam explicitamente o 'Carimbó' em diversos momentos, solidificando a identificação com este gênero musical tradicional e festivo do Pará, Brasil.","acordeão, percussão (surdo, chocalho), guitarra/violão, baixo elétrico, vocal masculino"
carimbo_Dança da Chama.mp3,carimbo,axé,"A música apresenta um ritmo contagiante e dançante, com forte presença de guitarra elétrica e uma percussão vibrante, características marcantes do axé. A letra, que convida à dança e celebra a energia (""vem pra roda, vem pra chama""), reforça a atmosfera festiva e elétrica típica do gênero baiano.","baixo marcante e rítmico, guitarra elétrica com riffs e base rítmica, bateria com batida constante e animada, percussão brasileira (incluindo tambor/tamborim), vocal feminino enérgico, ritmo sincopado e propício à dança"
carimbo_Dança da Maré (3).mp3,carimbo,carimbo,"A música apresenta um ritmo contagiante e dançante, com forte presença de percussão, incluindo o curimbó e a maraca, além de instrumentos de sopro como flauta e saxofone. A sonoridade remete diretamente às raízes do Carimbó, um estilo musical e de dança tradicional da região Norte do Brasil, especialmente do Pará. A letra também faz menção explícita ao 'curimbó' e 'maraca', solidificando a identificação do gênero.","percussão vibrante (curimbó, maraca, chocalhos), flauta e saxofone proeminentes, baixo e violão com linha rítmica marcada, vocal feminino melódico, ritmo alegre e dançante, característico da Amazônia"
carimbo_Dança da Morena.mp3,carimbo,carimbo,"A música apresenta um ritmo animado e contagiante, com percussão marcante que remete diretamente ao carimbó, um estilo musical e de dança originário do Pará. A letra também faz uma referência explícita ao 'Curimbó', instrumento central do gênero. A melodia e a instrumentação contribuem para uma atmosfera festiva e dançante, características do carimbó.","voz masculina, violão, percussão (curimbó, maracás, caixa), baixo, flauta/instrumento de sopro melódico, teclado/synth pad (fundo)"
rock_Ruído Na Cabeça.mp3,rock,rock,"A música apresenta guitarras elétricas distorcidas com riffs marcantes, bateria com um ritmo forte e constante, e vocais masculinos enérgicos e potentes, características predominantes do gênero rock.","guitarra elétrica distorcida, bateria potente, baixo, vocais masculinos enérgicos"
rock_Grito da Escuridão (1).mp3,rock,rock,"A música apresenta riffs de guitarra pesados e distorcidos, bateria com batidas rápidas e uso de bumbo duplo, baixo marcante e vocais masculinos agressivos (guturais), características predominantes do heavy metal, um subgênero do rock.","guitarra elétrica (com distorção), baixo elétrico, bateria (com bumbo duplo), vocais guturais masculinos"
rock_Eterna Noite de Sangue.mp3,rock,rock,"A música apresenta guitarras elétricas distorcidas, bateria rápida e agressiva com uso de bumbo duplo, e vocais guturais/gritados. Esses elementos são característicos do heavy metal, um subgênero do rock, que é a categoria mais adequada entre as opções fornecidas.","guitarras elétricas com distorção pesada, bateria com batidas rápidas e bumbo duplo, vocais guturais/gritados (harsh vocals), ritmo acelerado e agressivo, baixo potente e marcante"
rock_Metamorfose Silenciosa (1).mp3,rock,rock,"A música apresenta uma instrumentação clássica de rock, com guitarras elétricas e acústicas em destaque, baixo e bateria. O ritmo constante, a melodia introspectiva e o vocal masculino com timbre melancólico se alinham perfeitamente com subgêneros do rock, como o rock alternativo ou indie rock, diferenciando-se claramente dos outros estilos brasileiros e clássico listados.","guitarra acústica, guitarra elétrica, baixo, bateria, vocal masculino, melodia introspectiva, ritmo constante"
carimbo_Dançando na Areia (2).mp3,carimbo,carimbo,"A música apresenta um ritmo contagiante e dançante, com a sanfona/acordeon em destaque, acompanhada por percussão marcante e um baixo pulsante. A melodia e a instrumentação são características do Carimbó, um gênero musical e de dança tradicional da região amazônica do Brasil, especialmente do Pará. A letra menciona explicitamente 'o Carimbó chama' e 'dançando na areia', reforçando a identificação com o estilo.","sanfona/acordeon, percussão (tambores, chocalhos), baixo, voz feminina"
rock_Paixão em Ruínas.mp3,rock,rock,"A música apresenta guitarras elétricas distorcidas, uma bateria com ritmo marcante e enérgico, e um baixo presente, criando uma sonoridade poderosa e característica do rock. O vocal expressivo e a estrutura da canção também reforçam a identificação com o gênero.","guitarra elétrica distorcida, bateria com ritmo forte, baixo marcante, vocal masculino"
rock_Saudade Queima.mp3,rock,rock,"A música apresenta elementos clássicos do rock, como guitarras elétricas distorcidas com riffs e solos marcantes, uma bateria com batida forte e impulsionadora, e vocais masculinos potentes e carregados de emoção. A progressão da música, com seções mais calmas e explosões no refrão, é característica do gênero.","guitarra elétrica, bateria com ritmo forte, baixo, vocal masculino potente e melódico, guitarra acústica na introdução e partes mais suaves"
rock_Labirinto da Mente (2).mp3,rock,rock,"A música apresenta uma base de violão e guitarra elétrica, com bateria e baixo, e um vocal masculino melódico. A sonoridade remete a um rock mais introspectivo e melancólico, com elementos de rock alternativo ou pop-rock contemporâneo, distanciando-se de outros gêneros brasileiros.","violão, guitarra elétrica, baixo, bateria, vocal masculino"
rock_Inferno Tropical (1).mp3,rock,rock,"A música apresenta guitarras elétricas com distorção pesada, bateria com batidas contundentes e ocasionais ""double bass"", baixo proeminente e vocais que alternam entre agressivos (gritados/guturais) e melódicos, criando uma atmosfera intensa e poderosa. Essas características são marcantes do gênero rock, especialmente de subgêneros do metal.","guitarras elétricas distorcidas, bateria pesada com bumbo duplo ocasional, baixo proeminente, vocais gritados e limpos (guturais), riffs de guitarra agressivos, ritmo acelerado"
