ano,artista,faixa,genero1,id,arquivo,status,fechado_estilo,fechado_confianca,fechado_justificativa,tempo_fechado,aberto_estilo,aberto_subgeneros,aberto_confianca,aberto_justificativa,tempo_aberto
2023,Pato Fu,Ando meio desligado,rock,222,222_Pato Fu - Ando Meio Desligado.mp3,ok,rock,95.0,"A faixa apresenta instrumentação clássica do rock, com guitarras elétricas distorcidas, baixo e bateria, além de uma estrutura melódica e rítmica característica do rock nacional.",37.663820028305054,Indie Rock,"Rock Alternativo, Folk Rock, Pop Rock Brasileiro",95.0,"A faixa apresenta características típicas do Indie Rock brasileiro, com uma instrumentação baseada em guitarras que alternam entre timbres limpos e levemente saturados, baixo melódico e uma bateria com groove constante. A interpretação vocal é expressiva e introspectiva, característica comum no gênero. Há uma fusão de elementos do Rock Alternativo com uma estrutura Pop, resultando em uma sonoridade acessível, mas com texturas instrumentais elaboradas. A presença de nuances de Folk Rock é notada na composição melódica e na progressão harmônica.",43.41233515739441
2020,Tate McRae,Sports car,pop,159,159_Tate McRae - Sports car.mp3,ok,pop,95.0,"A faixa apresenta melodias cativantes, produção eletrônica polida e um ritmo dançante característico do pop contemporâneo, com foco em ganchos vocais acessíveis.",46.69625425338745,Electropop,"Hyperpop, Synth-pop, Dance-pop, Trap-pop",95.0,"A faixa apresenta uma fusão de elementos eletrônicos com estruturas de canção pop. Destacam-se o uso intensivo de processamento vocal (autotune), sintetizadores melódicos e uma base rítmica que combina o 4/4 do dance-pop com padrões de percussão derivados do Trap (hi-hats rápidos). A produção é caracterizada por texturas digitais limpas e uma dinâmica voltada para pistas de dança.",36.16320729255676
2023,"Tarcísio do Acordeon, Marcynho Sensação",Rolê,forró,68,68_ROLÊ - Tarcísio do Acordeon e Marcynho Sensação (Vai beber_ vai chorar_ vai ligar)(MP3_160K).mp3,ok,forró,95.0,"A faixa apresenta elementos característicos do piseiro, uma vertente moderna do forró, destacando-se pelo uso proeminente da sanfona e uma base rítmica eletrônica sincopada.",44.83621907234192,Forró,"Piseiro, Pisadinha, Forró Eletrônico",100.0,"A faixa é um exemplo clássico do Piseiro moderno, uma vertente do Forró. Caracteriza-se pela predominância do acordeon (sanfona) executando riffs melódicos e rítmicos, acompanhado por uma base de percussão eletrônica e sintetizadores que emulam a batida da 'pisadinha'. A estrutura vocal é energética, com letras focadas em temas festivos e românticos, além de apresentar a participação de expoentes do gênero como Xand Avião e Tarcísio do Acordeon, consolidando sua identidade dentro do Forró Eletrônico contemporâneo.",51.642438650131226
2020,"Mad Dogz, Felipe Amorim",Love Love + Eu,forró,74,74_Mad Dogz e Felipe Amorim - Love Love   Eu (Letra Oficial)(MP3_160K).mp3,ok,forró,95.0,"A música utiliza a base rítmica do piseiro, um subgênero do forró eletrônico, caracterizado por batidas sintetizadas e andamento acelerado.",32.07424306869507,Forró Eletrônico,"Piseiro, Sertanejo Universitário, Pop Brasileiro",98.0,"A faixa é caracterizada pela fusão da sanfona tradicional com batidas eletrônicas e percussão sequenciada, definindo o estilo Piseiro. A estrutura melódica e o estilo vocal de dueto/grupo, aliados a uma produção pop polida, demonstram a forte influência do Sertanejo Universitário contemporâneo, focando em temas de festividade e relacionamentos com apelo comercial.",26.279093980789185
2024,Bobby Helms,Jingle Bell Rock,pop,167,167_Bobby Helms - Jingle Bell Rock.mp3,ok,rock,100.0,"A faixa apresenta elementos clássicos do rock and roll dos anos 50, como o riff de guitarra elétrica, ritmo 4/4 com swing (shuffle) e instrumentação típica do gênero.",10.830537796020508,Rock and Roll,"Rockabilly, Christmas Music, Pop Rock, Swing",100.0,"A faixa apresenta características clássicas do Rock and Roll do final da década de 1950, com uma batida shuffle (swing feel) e instrumentação centrada na guitarra elétrica com timbre limpo e leve reverb. A estrutura harmônica é simples e direta, típica do Pop Rock da era, enquanto a temática lírica e os arranjos vocais em coro a classificam como música natalina. O estilo de tocar a guitarra, com licks melódicos entre as frases vocais, remete fortemente ao Rockabilly.",27.976208209991455
2019,"Mc IG, MC Ryan SP, DJ Glenner, Mc Poze do Rodo, Oruam",Filha do Deputado,funk,57,57_FILHA DO DEPUTADO - MC IG_ MC Ryan SP_ Poze do Rodo e Oruam (GR6 Explode) DJ Glenner e Daltin Beat(MP3_160K).mp3,ok,funk,95.0,"A faixa apresenta batida sincopada característica do funk brasileiro, produção eletrônica e lírica voltada à ostentação, com menção direta ao gênero na letra.",84.31037163734436,Funk Brasileiro,"Funk Ostentação, Funk Paulista, Trap-Funk",95.0,"A faixa apresenta a batida característica do funk brasileiro, com elementos de trap na produção (hi-hats rápidos e graves profundos). As letras focam em temas de ascensão social e luxo, típicos do Funk Ostentação, e a menção direta a São Paulo e o sotaque dos artistas confirmam a vertente paulista.",81.84399056434631
2022,Michel Teló,Meu Vício - Ao Vivo,sertanejo,15,15_Michel Teló - Meu Vício part. Mari Fernandez - Rolê Aleatório (Clipe Oficial)(MP3_160K).mp3,ok,sertanejo,95.0,"A composição apresenta elementos típicos do sertanejo universitário e piseiro, caracterizados pelo uso da sanfona, temática de 'sofrência' e um ritmo binário dançante.",51.572646617889404,Sertanejo Universitário,"Piseiro, Forró Eletrônico, Arrocha",100.0,"A faixa é uma colaboração entre Mari Fernandez e Nattan, expoentes do Piseiro moderno. A sonoridade combina a batida eletrônica característica da 'pisada' com o uso melódico do acordeon, típico do Forró Eletrônico. A estrutura lírica e a interpretação vocal exploram o romantismo e a sensualidade, elementos fundamentais do Arrocha, integrados à produção comercial do Sertanejo contemporâneo.",36.107993602752686
2015,*NSYNC,Bye Bye Bye - From Deadpool and Wolverine Soundtrack,pop,161,161_NSYNC - Bye Bye Bye.mp3,ok,pop,100.0,"A faixa apresenta produção polida, harmonias vocais características de boy bands, batida rítmica acentuada e estrutura melódica comercial, definindo o gênero teen pop do final dos anos 90.",18.32131290435791,Teen Pop,"Dance-Pop, Boy Band, Bubblegum Pop, R&B-Pop",100.0,"A faixa apresenta características marcantes da produção pop do final dos anos 90 e início dos 2000, como o uso extensivo de harmonias vocais em camadas, batidas eletrônicas sincopadas em 4/4 e sintetizadores digitais brilhantes. A estrutura é focada em ganchos melódicos (hooks) altamente memoráveis e uma produção polida, típica do subgênero Boy Band, mesclando elementos de R&B contemporâneo com uma estética puramente comercial e energética.",54.41850280761719
2023,Rionegro & Solimões,Vida de Cão - Ao Vivo,sertanejo,21,21_Vida De Cão(MP3_160K).mp3,ok,sertanejo,95.0,"A composição apresenta elementos centrais do sertanejo moderno, como o uso proeminente da sanfona, arranjos baseados em violão e temática lírica focada em desilusão amorosa e 'sofrência'.",53.68638062477112,Sertanejo,"Sertanejo Universitário, Arrocha, Modão, Sertanejo Romântico",100.0,"A faixa é um exemplo clássico do Sertanejo contemporâneo, caracterizada pelo uso proeminente da sanfona (acordeão) e do violão. A estrutura rítmica e a temática lírica focada na 'sofrência' (desilusão amorosa e consumo de álcool como refúgio) são pilares do gênero. A presença de diálogos introdutórios e interjeições durante a música remete à tradição das duplas sertanejas, enquanto a produção polida e o ritmo dançante a classificam dentro da vertente 'Universitário' com influências de Arrocha na cadência do refrão.",61.52147436141968
2021,Avine Vinny,Anota Aí - Ao Vivo,forró,70,70_Avine Vinny - Anota Aí _ Ao Vivo no _Quintou_(MP3_160K).mp3,ok,forró,95.0,"A faixa apresenta elementos característicos do forró eletrônico e piseiro, como o uso proeminente da sanfona e uma base rítmica binária acelerada típica do gênero.",49.48609137535095,Sertanejo Universitário,"Forró Eletrônico, Piseiro, Pop Brasileiro",95.0,"A faixa apresenta a estrutura típica do Sertanejo Universitário, com foco em melodias cativantes e letras sobre relacionamentos. A instrumentação combina o violão acústico com uma seção de metais e uma bateria com 'puxada' característica do Forró Eletrônico e do Piseiro, evidenciando a fusão de gêneros populares do Nordeste com o mercado sertanejo mainstream. A performance ao vivo e a interação com o público reforçam a estética de entretenimento de massa.",45.72868323326111
2025,Pitty,Me adora,rock,219,219_Pitty - Me Adora.mp3,ok,rock,95.0,"A faixa apresenta instrumentação característica do rock, com guitarras elétricas distorcidas, baixo e bateria marcantes. A estrutura da canção e a entrega vocal são típicas do pop-rock brasileiro dos anos 90/2000.",65.56235861778259,Rock Nacional,"Pop Rock, Rock Alternativo, Indie Rock",95.0,"A faixa apresenta uma instrumentação clássica de rock (guitarras com distorção, baixo e bateria) combinada com uma estrutura melódica acessível e refrão cativante, típicos do Pop Rock brasileiro. A dinâmica entre versos mais limpos e refrões intensos, aliada à interpretação vocal expressiva em português, caracteriza o gênero Rock Nacional com influências do rock alternativo contemporâneo.",56.59629988670349
2020,Lizzo,Boys,pop,169,169_Lizzo - Boys.mp3,ok,pop,95.0,"A faixa apresenta uma produção rítmica de alta energia, com ganchos vocais cativantes e repetitivos, típicos do pop contemporâneo. Embora incorpore elementos de funk e hip-hop, sua estrutura e apelo comercial a enquadram no gênero pop.",22.20957326889038,Pop,"Funk-pop, Hip-hop, Dance-pop, Electropop",95.0,"A faixa apresenta uma fusão característica de elementos do pop contemporâneo com uma linha de baixo sincopada e groovada, típica do funk. A entrega vocal alterna entre o rap rítmico e ganchos melódicos cativantes, enquanto a produção eletrônica, com batidas de sintetizador e percussão digital, reforça sua natureza dance-pop. A estrutura da música é voltada para o rádio, com um refrão forte e repetitivo.",8.840945482254028
2025,Os paralamas do sucesso,Meu erro,rock,225,225_Os Paralamas Do Sucesso - Meu Erro.mp3,ok,rock,95.0,"A faixa apresenta instrumentação característica do rock, com guitarras elétricas em destaque (alternando entre timbres limpos e distorcidos), baixo melódico e bateria com acentuação constante no backbeat. A estrutura harmônica e a entrega vocal seguem a estética do pop-rock brasileiro.",44.50178861618042,Pop Rock,"Pop Rock Nacional, Soft Rock, Power Pop, Rock Alternativo",95.0,"A faixa apresenta uma instrumentação clássica de banda de rock (guitarras, baixo e bateria) com uma produção polida e foco em melodias cativantes e radiofônicas. A estrutura harmônica é predominantemente diatônica, característica do Pop Rock brasileiro dos anos 90 e 2000. O ritmo é constante em 4/4, com ênfase no 'backbeat' e vocais melódicos que priorizam a acessibilidade e o refrão marcante.",41.95501685142517
2021,Mariah Carey,All I Want for Christmas Is You,pop,164,164_Mariah Carey - All I Want for Christmas Is You.mp3,ok,pop,100.0,"A canção apresenta estrutura verso-refrão bem definida, melodia cativante (hook), produção polida e instrumentação típica do gênero, com foco no apelo comercial e vocal expressivo.",42.66932129859924,Pop Natalino,"Soul-Pop, Gospel, Doo-wop, Contemporary R&B",100.0,"A faixa é uma reinterpretação fiel do estilo estabelecido por clássicos natalinos modernos, caracterizada pelo uso de 'sleigh bells', arranjos de metais (brass section) enérgicos e uma progressão harmônica que mistura o pop com o soul dos anos 60. A performance vocal é técnica e melismática, típica do R&B contemporâneo, enquanto os backing vocals utilizam harmonias densas inspiradas no Gospel e no Doo-wop.",27.758724451065063
2000,NATTAN,Eu Confiei Em Ti,forró,71,71_Nattan - Confiei em Ti (Nem eu que chorei um oceano) (Vídeo Oficial)(MP3_160K).mp3,ok,forró,95.0,"A faixa apresenta elementos centrais do forró universitário e piseiro, como o uso proeminente da sanfona, um ritmo binário dançante e letras focadas em relacionamentos e desilusões amorosas.",33.35811686515808,Sertanejo Universitário,"Arrocha, Sertanejo Pop, Bachata",98.0,"A faixa apresenta a estrutura rítmica e melódica característica do Sertanejo Universitário moderno, com ênfase na levada de 'Arrocha' durante o refrão. A instrumentação combina o violão acústico (nylon) com uma seção de metais (trompetes e trombones) que confere uma sonoridade pop/big band. A interpretação vocal utiliza melismas e uma dicção típica do gênero, focada em temas de desilusão amorosa e superação. A produção sonora é comercial, com compressão acentuada e arranjos dinâmicos voltados para o entretenimento dançante.",54.89390969276428
2013,Zé Vaqueiro,Eu Tenho Medo,forró,67,67_Zé Vaqueiro - Tenho Medo (Video Oficial)(MP3_160K).mp3,ok,forró,95.0,"A faixa apresenta o ritmo característico do piseiro/forró eletrônico, com batida 2/4 marcada, timbres de teclado simulando sanfona e temática de vaquejada.",62.654757499694824,Forró,"Piseiro, Forró de Vaquejada, Arrocha",95.0,"A faixa é caracterizada por uma rítmica binária sincopada, com a sanfona (acordeão) desempenhando o papel melódico e harmônico central. A base percussiva é marcada e constante, típica das vertentes modernas do Forró, como o Piseiro. A temática lírica aborda o cotidiano do vaqueiro e desilusões amorosas, elementos fundamentais do Forró de Vaquejada. A interpretação vocal e a estrutura harmônica também apresentam intersecções com o Arrocha e o Sertanejo contemporâneo.",56.45929479598999
2017,João Gomes,Lembrei de Nós,forró,75,75_João Gomes Cantor - LEMBREI DE NÓS - João Gomes_ _mestrinhooficial e _Jota.Pe.Oficial (Dominguinho)(MP3_160K).mp3,ok,mpb,95.0,"A composição apresenta arranjos sofisticados com destaque para o violino e violão acústico, aliados a uma interpretação vocal melódica e letras poéticas, elementos centrais da Música Popular Brasileira contemporânea.",41.56985926628113,MPB (Música Popular Brasileira),"Bossa Nova, Samba-Jazz, Nova MPB, Folk Brasileiro",98.0,"A composição exibe uma harmonia sofisticada, rica em acordes com extensões (sétimas e nonas) e uma rítmica baseada na síncope do samba, característica da 'levada' de Bossa Nova no violão de nylon. A instrumentação, que destaca a flauta transversal e o acordeom (mencionado por Mestrinho), aliada ao canto suave e intimista, define a estética da Nova MPB. A estrutura melódica é fluida e dialoga diretamente com o Jazz-Samba, mantendo uma sonoridade acústica e orgânica.",30.94316792488098
2025,Billie Eilish,LUNCH,pop,160,160_Billie Eilish - LUNCH.mp3,ok,pop,95.0,"A faixa apresenta produção polida, estrutura verso-refrão bem definida, vocais melódicos e uma combinação de elementos eletrônicos com instrumentos orgânicos (guitarra e baixo) típicos do pop contemporâneo.",39.92105436325073,Indie Pop,"Funk Pop, Nu-Disco, Dance-Pop, Alternative Pop",95.0,"A faixa apresenta uma fusão característica de elementos do pop moderno com uma base rítmica fortemente influenciada pelo funk. Destacam-se as guitarras elétricas limpas e percussivas, uma linha de baixo melódica e 'groovada', e o uso de sintetizadores que remetem ao nu-disco. A estrutura da canção segue o padrão verso-refrão com uma produção polida, típica do dance-pop contemporâneo, enquanto a entrega vocal e a instrumentação orgânica conferem uma estética de indie pop/alternative pop.",49.92560052871704
2016,Xand Avião,Casal Raiz - Ao Vivo,forró,73,73_Xand Avião - Casal Raiz (Clipe Oficial)(MP3_160K).mp3,ok,sertanejo,100.0,"A faixa apresenta instrumentação característica do sertanejo moderno, com destaque para o violão e a sanfona, além de uma temática lírica voltada para relacionamentos cotidianos e uma estrutura melódica típica do gênero.",45.97201943397522,Sertanejo,"Sertanejo Universitário, Arrocha, Forró",100.0,"A faixa apresenta características marcantes do Sertanejo contemporâneo, como o uso proeminente da sanfona e do violão, ritmo sincopado em 4/4 e temática lírica voltada para relacionamentos cotidianos com gírias atuais ('Nutella' vs 'Raiz'). A estrutura vocal e a interação com o público em uma gravação ao vivo são típicas do Sertanejo Universitário, com influências rítmicas do Arrocha e do Forró.",41.10226035118103
2024,Henrique & Juliano,Bateria Externa - Ao Vivo,sertanejo,6,6_Henrique e Juliano - BATERIA EXTERNA - DVD Ao Vivo No Ibirapuera(MP3_160K).mp3,ok,sertanejo,95.0,"A faixa apresenta características típicas do sertanejo universitário, como o uso de violão acústico, temática de relacionamentos e uma estrutura melódica pop-sertaneja.",51.306673765182495,Sertanejo Universitário,"Arrocha, Pop Sertanejo, Sertanejo Acústico",98.0,"A faixa apresenta características fundamentais do Sertanejo Universitário contemporâneo, como a instrumentação centrada no violão de aço e percussão leve, aliada a uma temática lírica focada em relacionamentos cotidianos e vida social. O ritmo possui o 'balanço' típico do Arrocha, com uma estrutura melódica pop e harmonias vocais bem definidas. A produção valoriza a clareza acústica, mantendo uma cadência dançante e comercial.",58.134756565093994
2024,Diego & Victor Hugo,Tubarões - Ao Vivo,sertanejo,22,22_Diego e Victor Hugo - Tubarões(MP3_160K).mp3,ok,sertanejo,95.0,"A faixa apresenta características marcantes do sertanejo contemporâneo, como a interpretação vocal melódica com ênfase emocional, arranjos baseados em violão e guitarra, e temática romântica. A estrutura harmônica e o estilo de performance ao vivo são típicos do gênero.",33.443042516708374,Sertanejo Universitário,"Sertanejo Pop, Sertanejo Romântico, Arrocha, Pop Brasileiro",100.0,"A faixa apresenta as características definidoras do Sertanejo Universitário contemporâneo, unindo a instrumentação acústica (violão) a uma produção de palco robusta com guitarras elétricas e bateria de pegada pop/rock. A interpretação vocal é marcada por melismas expressivos e uma entrega emocional intensa, típica do gênero. A estrutura harmônica é baseada em progressões diatônicas acessíveis, focadas em um refrão de forte apelo popular. A rítmica em 4/4, com nuances que remetem ao arrocha na acentuação, e a temática lírica de superação amorosa confirmam a classificação.",36.79749870300293
2020,Skank,Algo Parecido,mpb,101,101_Skank - Algo Parecido.mp3,ok,pop,95.0,"A faixa apresenta uma estrutura melódica radiofônica, produção polida com foco em violão acústico e vocais suaves, características centrais do pop contemporâneo brasileiro.",19.521509408950806,Nova MPB,"Pop Folk, Indie Pop, Acoustic Pop",95.0,"A faixa é um exemplo clássico da vertente contemporânea da MPB, caracterizada por uma instrumentação orgânica onde o violão de aço dita a base rítmica e harmônica. A produção limpa, os vocais suaves e melódicos, e a fusão de elementos do folk internacional com a canção popular brasileira definem a sonoridade. A estrutura composicional foca em ganchos melódicos acessíveis e uma atmosfera otimista, típica de artistas do gênero como Tiago Iorc e Melim.",40.25480628013611
2022,"Jimin, Loco",Smeraldo Garden Marching Band (feat. Loco),pop,162,"162_Jimin, Loco - Smeraldo Garden Marching Band (feat. Loco).mp3",ok,pop,98.0,"A faixa apresenta produção polida, estrutura de verso-refrão com ganchos melódicos marcantes e batida eletrônica característica do dance-pop contemporâneo.",27.957475423812866,K-pop,"Dance-pop, Synth-pop, K-Hip Hop, Bubblegum Pop",100.0,"A faixa apresenta as características clássicas da música pop coreana contemporânea, incluindo uma produção eletrônica polida, alternância entre versos cantados e rimas de hip-hop, e uma estrutura de refrão 'catchy' com harmonias vocais em grupo. A instrumentação é dominada por sintetizadores e batidas eletrônicas em 4/4, típicas do dance-pop.",58.007861614227295
2022,Billie Eilish,CHIHIRO,pop,158,158_Billie Eilish - CHIHIRO.mp3,ok,pop,95.0,"A faixa apresenta produção eletrônica polida, vocais melódicos, estrutura de canção convencional e uso de sintetizadores contemporâneos, características centrais do gênero pop moderno.",60.48504638671875,Indie Pop,"Synth-pop, Dream Pop, Bedroom Pop, Alt-Pop",95.0,"A faixa apresenta uma fusão de texturas eletrônicas com uma sensibilidade indie. Os vocais são suaves e atmosféricos, típicos do Dream Pop, enquanto a instrumentação baseada em sintetizadores e batidas eletrônicas programadas define o Synth-pop. A produção polida, mas com nuances introspectivas, alinha-se ao Bedroom Pop e ao Alt-Pop contemporâneo.",58.52281618118286
2005,Twenty One Pilots,The contract,rock,227,227_Twenty One Pilots - The Contract.mp3,ok,rock,95.0,"A faixa apresenta guitarras elétricas distorcidas, uma bateria enérgica e vocais característicos do rock alternativo, com estrutura harmônica e rítmica típicas do gênero.",49.35168695449829,Indie Pop-Rock,"Alternative Rock, Indie Pop, Pop Rock, Modern Rock",95.0,"A faixa apresenta uma fusão de elementos do rock alternativo com a acessibilidade melódica do pop. Caracteriza-se por guitarras elétricas com timbres variando entre o limpo e o levemente saturado, batidas de bateria enérgicas em 4/4 e uma produção polida que incorpora sintetizadores. A estrutura verso-refrão é bem definida, com ganchos vocais cativantes típicos do Indie Pop contemporâneo.",42.53593683242798
2023,Beach Weather,"Sex, drugs, etc",rock,228,"228_Beach Weather - Sex, Drugs, Etc..mp3",ok,pop,90.0,"A composição utiliza uma estrutura melódica acessível, produção de estúdio polida, harmonias vocais em camadas e uma fusão de elementos eletrônicos com instrumentação orgânica, definindo o gênero pop contemporâneo.",42.8636531829834,Indie Rock,"Alternative Rock, Indie Pop, Synth-pop, Anthem Rock",95.0,"A faixa apresenta uma fusão característica do Indie Rock moderno, combinando guitarras elétricas (ora limpas, ora distorcidas) com sintetizadores atmosféricos. A estrutura rítmica é enérgica e impulsionada por uma bateria de rock convencional, enquanto a melodia vocal e a produção polida remetem ao Indie Pop. O refrão 'anthemic' e o uso de camadas sonoras densas são típicos do rock alternativo contemporâneo.",47.26651668548584
2017,Jimin,Who,pop,165,165_Jimin - Who.mp3,ok,pop,95.0,"A faixa apresenta uma produção polida com foco em ganchos melódicos acessíveis, estrutura verso-refrão bem definida e uma fusão de instrumentação orgânica com elementos eletrônicos, típica do pop contemporâneo.",34.802520751953125,Nu-Disco,"Funk-Pop, Dance-Pop, Synth-Pop, Disco-Revival",95.0,"A faixa apresenta uma fusão característica de elementos do funk dos anos 70 com produção pop contemporânea. Destacam-se a linha de baixo sincopada e groovada, guitarras rítmicas com timbres limpos e 'estralados' (funk scratching), e o uso extensivo de vocais em falsete, remetendo ao disco clássico. A estrutura rítmica é baseada em um beat 4/4 constante, típico do dance-pop moderno, com camadas de sintetizadores que conferem uma sonoridade polida e comercial.",50.2155179977417
2024,O Rappa,Anjos,rock,217,217_O Rappa - Anjos (Pra quem tem fé).mp3,ok,rock,100.0,"A faixa apresenta instrumentação característica do rock nacional, com guitarras elétricas, bateria marcante e estrutura de canção pop-rock, sendo uma obra icônica da banda O Rappa.",65.91277027130127,Reggae Rock,"Rock Alternativo, Dub, Hip Hop, MPB, Pop Rock",98.0,"A faixa apresenta uma fusão característica do grupo O Rappa, combinando a base rítmica do reggae (acentuação no terceiro tempo) com a energia e distorção do rock alternativo. A presença de elementos do dub é notada nos efeitos de ambiência e no baixo proeminente, enquanto o fraseado vocal incorpora métricas do hip hop. A composição também se insere no contexto da MPB contemporânea pela profundidade lírica e temática social.",95.73368644714355
2018,Skillet,Psycho in my head,rock,230,230_Skillet - Psycho In My Head.mp3,ok,rock,100.0,"A faixa apresenta guitarras elétricas com distorção, bateria enérgica e vocais agressivos, características fundamentais do rock moderno.",46.00903367996216,Nu Metal / Alternative Metal,"Post-Hardcore, Melodic Metalcore, Hard Rock Moderno",95.0,"A faixa apresenta características marcantes do Nu Metal e Metalcore melódico, como o uso de guitarras com afinações baixas e distorção densa, alternância entre vocais limpos e guturais/gritados (screams), e uma estrutura rítmica sincopada com forte presença de bateria. A produção é moderna, com camadas de sintetizadores sutis e uma mixagem que privilegia o peso das frequências graves e a clareza da voz no refrão, típico do rock alternativo contemporâneo.",35.21353030204773
