ano,artista,faixa,genero1,id,arquivo,status,fechado_estilo,fechado_confianca,fechado_justificativa,tempo_fechado,aberto_estilo,aberto_subgeneros,aberto_confianca,aberto_justificativa,tempo_aberto
2022,Wesley Safadão,Seis Cordas,forró,66,66_Wesley Safadão - Seis Cordas - Baião de Dois - Cavalo Lampião - Forró e Vaquejada(MP3_160K).mp3,ok,forró,100.0,"A faixa apresenta elementos característicos do forró eletrônico e piseiro, como o uso proeminente da sanfona, ritmo sincopado acelerado e temática de vaquejada, explicitamente mencionada pelo artista no início da gravação.",70.1838026046753,Forró,"Forró Eletrônico, Piseiro, Forró de Vaquejada",98.0,"A faixa apresenta a instrumentação clássica do forró contemporâneo, com a sanfona (acordeão) liderando a melodia sobre uma base rítmica de bateria e baixo elétrico. A letra faz referências diretas à cultura da vaquejada e do sertão, características fundamentais do Piseiro. O andamento acelerado e a produção moderna com elementos eletrônicos definem o subgênero Forró Eletrônico.",76.1444787979126
2025,Felipe Amorim,Teus Sinais,forró,76,76_Felipe Amorim - Teus Sinais (Clipe Oficial)(MP3_160K).mp3,ok,pagode,95.0,"A faixa apresenta elementos rítmicos e instrumentais característicos do pagode, como o uso do cavaquinho, percussão marcante (pandeiro e surdo) e uma estrutura melódica vocal típica do gênero.",39.53622770309448,Sertanejo Universitário,"Pop Sertanejo, Arrocha, Sertanejo Romântico",95.0,"A faixa apresenta a rítmica e instrumentação características do Sertanejo Universitário, com o uso proeminente de violão e uma produção voltada para o pop. A estrutura melódica e a entrega vocal são típicas do gênero, incorporando elementos de arrocha no refrão, o que confere uma sonoridade dançante e comercial.",50.32310700416565
2024,Nattanzinho Lima,Uma e Quinze da Manhã,forró,77,77_Natanzinho Lima - Uma e Quinze da Manhã - No Doze(MP3_160K).mp3,ok,sertanejo,95.0,"Presença marcante de sanfona, temática lírica de sofrência e consumo de álcool, além de estrutura rítmica e melódica característica do sertanejo universitário.",44.11709976196289,Arrocha,"Sertanejo Universitário, Pop Sertanejo, Arrocha-Pop",95.0,"A faixa apresenta a rítmica característica do Arrocha, com ênfase no balanço percussivo e teclados que marcam a harmonia de forma sincopada. A instrumentação, que inclui guitarras com timbres limpos e arranjos de metais sintetizados, aliada à interpretação vocal melódica e sentimental, é típica do Sertanejo Universitário contemporâneo. A estrutura de produção é polida, visando o apelo comercial do Pop brasileiro atual.",42.109686851501465
2019,"Tarcísio do Acordeon, Vitor Fernandes",Nêga,forró,72,72_NÊGA - Tarcísio do Acordeon e Vitor Fernandes (CLIPE OFICIAL)(MP3_160K).mp3,ok,forró,95.0,"A faixa apresenta elementos característicos do piseiro, uma vertente moderna do forró, destacando-se pelo uso proeminente da sanfona, ritmo sincopado e temática de vaquejada.",43.789406299591064,Forró,"Piseiro, Forró Eletrônico, Sertanejo",98.0,"A faixa é caracterizada pelo uso proeminente da sanfona (acordeão) sobre uma base rítmica eletrônica e sincopada, típica do Piseiro. A estrutura harmônica é simples e direta, focada na dançabilidade e na melodia vocal, que carrega influências do Sertanejo contemporâneo em sua interpretação e temática lírica.",71.76014423370361
2018,João Gomes,Flor de flamboyant,forró,78,78_FLOR DE FLAMBOYANT - João Gomes_ _mestrinhooficial e _Jota.Pe.Oficial (Dominguinho)(MP3_160K).mp3,ok,forró,98.0,"A composição apresenta elementos fundamentais do gênero, como o uso proeminente da sanfona, ritmo de xote/toada e temática lírica romântica com referências à cultura regional nordestina.",38.906651735305786,Forró,"Xote, Forró Universitário, Música Nordestina, Toada",100.0,"A faixa é um exemplo clássico de Forró, especificamente na variante rítmica do Xote, caracterizada pelo andamento moderado e a síncope rítmica executada pela sanfona e pela base de violão. A instrumentação centraliza-se no acordeão (sanfona), que conduz a melodia e a harmonia, enquanto a letra e a interpretação vocal remetem à tradição das vaquejadas e do cancioneiro nordestino. A produção sonora e o arranjo indicam uma influência do Forró Universitário, com uma sonoridade mais limpa e voltada para o apelo romântico.",45.33485960960388
2024,Spice Girls,Wannabe,pop,234,234_Spice Girls - Wannabe.mp3,ok,pop,95.0,"A faixa apresenta características típicas do gênero pop, como andamento acelerado, ganchos melódicos cativantes e repetitivos, harmonias vocais e uma estrutura de produção voltada para o apelo comercial mainstream.",33.695127725601196,Pop Acústico,"Folk Pop, Indie Pop, Cover, Bubblegum Pop",100.0,"A faixa é uma reinterpretação acústica do hit 'Wannabe' das Spice Girls. A sonoridade é definida pelo uso predominante de violão de aço, harmonias vocais em camadas e uma percussão orgânica leve. A abordagem transforma o dance-pop original em um arranjo folk-pop, caracterizado por timbres naturais e uma estética de 'singer-songwriter', mantendo a estrutura melódica cativante da composição original.",19.994187116622925
2009,Raí Saia Rodada,Tapão Na Raba,forró,79,79_Tapão Na Raba Raí Saia Rodada - Musics 2020- 2021- TAPÃO NA RABA LETRA(MP3_160K).mp3,ok,forró,95.0,"A faixa apresenta uma base rítmica sincopada característica do piseiro, vertente moderna do forró, com uso de percussão eletrônica e padrões melódicos típicos do gênero.",32.557424545288086,Piseiro,"Arrocha, Sertanejo Universitário, Tecno-brega, Forró Eletrônico",98.0,"A faixa é um exemplo clássico de Piseiro, caracterizado por sua base rítmica eletrônica derivada do forró (a 'pisadinha'), com andamento acelerado e síncope marcante. A instrumentação é dominada por sintetizadores que substituem o acordeão tradicional, acompanhados por batidas de drum machine e baixo sintetizado. O estilo vocal e a temática lírica aproximam-se do Arrocha e do Sertanejo Universitário, enquanto a estética sonora geral remete ao Tecno-brega pela crueza dos timbres eletrônicos.",48.28731679916382
2025,Black eyed pears,RITMO (Bad Boys For Life),pop,168,"168_Black Eyed Peas, J Balvin - RITMO (Bad Boys For Life).mp3",ok,pop,95.0,"A faixa apresenta uma fusão de elementos de dance music eletrônica com ritmos de reggaeton (dembow), estrutura de canção comercial e uso de samples de sucessos pop globais.",35.10956072807312,Reggaeton / Dance-Pop,"Moombahton, Eurodance, Latin Urban, Electropop",100.0,"A faixa é uma reinterpretação contemporânea do clássico Eurodance dos anos 90, integrando o icônico sample de 'The Rhythm of the Night' a uma estrutura rítmica de Reggaeton (dembow). A fusão de elementos da música eletrônica de pista (House) com a cadência urbana latina e vocais bilíngues caracteriza o estilo Moombahton e o Dance-Pop moderno.",45.378719329833984
2020,Maroon 5,Moves like Jagger,pop,231,"231_Maroon 5, Christina Aguilera - Moves Like Jagger.mp3",ok,pop,95.0,"Trata-se de uma versão acústica de um sucesso mainstream (Maroon 5), com estrutura melódica e rítmica característica do gênero pop.",54.0155246257782,Pop Acústico,"Fingerstyle, Soft Pop, Singer-Songwriter, Contemporary Folk-Pop",95.0,"A faixa apresenta uma reinterpretação minimalista de uma composição pop mainstream, centrada exclusivamente em voz e violão. A técnica de execução do violão combina dedilhados (fingerstyle) com elementos percussivos nas cordas para emular a seção rítmica original. A estética é orgânica, priorizando a clareza melódica e uma entrega vocal intimista, típica de arranjos 'unplugged'.",33.82604241371155
2020,ANAVITÓRIA,Me conta da tua janela,mpb,106,106_ANAVITÓRIA - Me conta da tua janela.mp3,ok,mpb,95.0,"A composição apresenta arranjo acústico centrado no violão e vocais melódicos com foco na interpretação lírica, características fundamentais da Música Popular Brasileira.",9.058783292770386,Nova MPB,"Indie Pop, Folk-Pop, Bossa Pop, Pop Brasileiro",98.0,"A faixa exemplifica o movimento da 'Nova MPB', com foco em arranjos acústicos minimalistas, harmonias vocais suaves e uma estética de produção intimista. A rítmica do violão de nylon e a melodia fundem a tradição da canção brasileira com elementos do pop contemporâneo e folk, enquanto a letra apresenta uma temática introspectiva e urbana.",34.269731760025024
2013,"Zé Vaqueiro, João gomes",Arriadin por tu,forró,171,"171_Zé Vaqueiro, João Gomes - Arriadin por Tu - Ao Vivo.mp3",ok,forró,98.0,"A faixa apresenta elementos fundamentais do piseiro, uma vertente moderna do forró, caracterizada pelo uso proeminente da sanfona, batida eletrônica sincopada e temática regional.",31.09231400489807,Piseiro,"Forró, Vaquejada, Arrocha, Sertanejo",100.0,"A faixa apresenta as características fundamentais do Piseiro, uma vertente moderna e eletrônica do Forró. Destaca-se o uso de batidas programadas sincopadas, a proeminência da sanfona (acordeão) com frases melódicas rápidas e a estrutura harmônica simplificada. A temática lírica foca no romantismo e no universo da vaquejada, elementos centrais da identidade estética de artistas como João Gomes e Zé Vaqueiro, que interpretam a canção.",24.87076759338379
2023,Maneskin,Coraline,rock,226,226_Måneskin - CORALINE.mp3,ok,rock,95.0,"A faixa apresenta uma estrutura de rock alternativo, caracterizada pela transição entre versos melódicos e refrões intensos com guitarras distorcidas e bateria enérgica.",72.26204562187195,Pop Rock Italiano,"Rock Alternativo, Pop Acústico, Power Ballad, Indie Rock",100.0,"A faixa apresenta uma estrutura dinâmica de power ballad, iniciando com um arranjo minimalista de violão e voz (pop acústico) e evoluindo para um clímax de rock alternativo com guitarras distorcidas e bateria intensa. A performance vocal é expressiva e característica do rock contemporâneo italiano, utilizando variações de dinâmica para enfatizar a narrativa lírica.",54.75828742980957
2019,ANAVITÓRIA,A Gente Junto,mpb,102,102_ANAVITÓRIA - A Gente Junto.mp3,ok,mpb,95.0,"A faixa apresenta características típicas da MPB contemporânea, com foco na melodia vocal suave, letras poéticas em português e um arranjo que mescla instrumentos acústicos com elementos eletrônicos sutis, mantendo uma sonoridade sofisticada e relaxada.",46.24962639808655,Nova MPB,"Bossa Nova, Indie Pop Brasileiro, Jazz-Pop",95.0,"A faixa apresenta uma fusão contemporânea de elementos tradicionais da música brasileira com produção moderna. A base rítmica é construída sobre uma levada de violão sincopada, característica da Bossa Nova, acompanhada por uma percussão suave e precisa. A harmonia é sofisticada, utilizando acordes com extensões (sétimas e nonas) típicos do Jazz. O vocal é intimista e coloquial, remetendo ao estilo 'canto falado' de João Gilberto, mas inserido em uma estética de produção limpa e atual, definindo o que se convencionou chamar de Nova MPB.",32.74514293670654
2025,"The Weeknd, Anitta",São Paulo (feat. Anitta),pop,166,"166_The Weeknd, Anitta - São Paulo (feat. Anitta).mp3",ok,funk,90.0,"A faixa é um mashup que utiliza a base rítmica do funk carioca (tamborzão) como elemento estrutural predominante, combinando vocais explícitos em português com elementos de pop internacional.",50.22292470932007,Funk Carioca,"Phonk, Pop, R&B, Funk Mandelão, Mashup",95.0,"A faixa apresenta uma estrutura de mashup que alterna entre o ritmo 'tamborzão' agressivo do Funk Carioca e seções melódicas de Pop/R&B. A sonoridade é marcada por graves altamente distorcidos e uma estética 'dark', características fundamentais do Phonk e do Funk Mandelão, criando um contraste dinâmico entre os vocais em português e inglês.",64.32320404052734
1973,The beatles,Now and then,rock,229,229_The Beatles - Now And Then.mp3,ok,rock,100.0,"A faixa apresenta instrumentação clássica do gênero, com guitarras acústicas e elétricas, bateria e baixo, além de uma estrutura melódica e vocal característica do rock/pop-rock britânico.",62.81639862060547,Pop Rock,"Britpop, Soft Rock, Baroque Pop, Psychedelic Pop",95.0,"A faixa apresenta uma estrutura clássica de canção pop-rock, com ênfase em melodias vocais expressivas e uma progressão harmônica que remete ao final dos anos 60 e início dos 70. A instrumentação combina violão acústico, guitarras elétricas com timbres limpos, piano e arranjos de cordas, características marcantes do Baroque Pop e do Britpop. A produção equilibra uma sonoridade vintage com técnicas modernas de mixagem, resultando em uma balada emocional e hínica.",59.8539764881134
2002,Taylor Swift,Shake it off,pop,233,233_Taylor Swift - Shake It Off.mp3,ok,pop,100.0,"A faixa apresenta uma estrutura de verso-refrão bem definida, produção polida com ganchos melódicos repetitivos e arranjo rítmico dançante, características fundamentais do gênero pop.",57.09437656402588,Pop,"Dance-Pop, Synth-Pop, Bubblegum Pop",98.0,"A faixa apresenta uma estrutura rítmica 4/4 pulsante, com forte ênfase em sintetizadores e produção eletrônica polida. A melodia é altamente cativante (hook-driven), característica do Bubblegum Pop, enquanto a batida energética e os arranjos de metais sintetizados a enquadram no Dance-Pop. A entrega vocal é rítmica e melódica, típica das produções de rádio contemporâneas.",31.73601794242859
2025,"Cleber & Cauan, Jorge",Pedaço Meu - Ao Vivo,sertanejo,7,7_Cleber e Cauan Part. Jorge - Pedaço Meu  _ Surreal (Vídeo Oficial)(MP3_160K).mp3,ok,sertanejo,95.0,"A composição apresenta elementos centrais do sertanejo universitário, como a temática de 'sofrência' focada em desilusão amorosa e consumo de álcool, além de uma instrumentação que combina violão acústico com uma produção pop de grande porte, típica de gravações ao vivo do gênero.",36.99717354774475,Sertanejo,"Sertanejo Universitário, Pop Sertanejo, Arrocha, Sofrência",98.0,"A faixa apresenta elementos fundamentais do Sertanejo contemporâneo, como a instrumentação centrada no violão, letras que exploram a temática da 'sofrência' e da boemia, e uma estrutura rítmica que transita entre a balada e o arrocha. A performance ao vivo, com arranjos de banda completa e forte apelo melódico, é característica do Sertanejo Universitário.",54.67891192436218
2024,Magic,Rude,pop,238,238_MAGIC! - Rude.mp3,ok,pop,95.0,"A faixa apresenta uma estrutura clássica de canção popular, com refrão cativante, produção polida e elementos de reggae-pop voltados para o consumo em massa.",26.325175523757935,Reggae Fusion,"Pop Reggae, Ska-Pop, Contemporary Pop",98.0,"A faixa utiliza a rítmica fundamental do reggae, especificamente o 'skank' de guitarra (acentuação nos tempos fracos) e uma linha de baixo melódica e proeminente. No entanto, a produção é nitidamente voltada ao mercado Pop, com vocais limpos, estrutura de canção radiofônica e ausência de elementos densos de Dub ou raízes do Roots Reggae. A cadência é leve e comercial, característica do subgênero Reggae-Pop.",28.496559381484985
2023,Rihanna,Only girl,pop,236,236_Rihanna - Only Girl (In The World).mp3,ok,pop,98.0,"A faixa apresenta produção eletrônica de alta energia, refrão cativante e estrutura melódica característica do pop comercial contemporâneo.",21.1604585647583,Dance-Pop,"Electropop, Eurodance, Synth-pop, Club-house",100.0,"A faixa é caracterizada por uma batida 'four-on-the-floor' constante, típica da música dance, combinada com uma estrutura de canção pop focada em ganchos vocais melódicos e repetitivos. A instrumentação é predominantemente eletrônica, utilizando sintetizadores com timbres brilhantes e compressão dinâmica acentuada, elementos fundamentais do Dance-Pop e Electropop contemporâneo. A energia rítmica e a produção polida visam tanto as pistas de dança quanto o rádio comercial.",44.374452352523804
2013,Thiaguinho ,Pé na areia,pagode,81,81_Thiaguinho - Pé Na Areia (Álbum Tardezinha 2) [Áudio Oficial](MP3_160K).mp3,ok,pagode,100.0,"Presença marcante de cavaquinho e percussão característica (pandeiro, surdo), ritmo binário sincopado e temática lírica festiva típica do gênero.",37.409862756729126,Pagode,"Pagode Romântico, Samba, Pop-Samba, Samba de Raiz (releitura)",100.0,"A faixa apresenta as características fundamentais do pagode moderno, com ênfase no uso do cavaquinho e percussão característica (pandeiro, surdo, reco-reco). A estrutura harmônica utiliza progressões típicas do samba, mas com uma abordagem melódica pop e refrão de fácil memorização, voltado para o entretenimento de massa. A performance ao vivo, parte do projeto 'Tardezinha', destaca a interação constante com o público e o uso de backing vocals em coro, elementos centrais da estética do gênero. A instrumentação combina o regionalismo do samba com uma produção contemporânea e comercial.",40.343140602111816
2022,Belo,Reinventar,pagode,100,100_Belo - Reinventar.mp3,ok,pop,95.0,"A faixa apresenta características típicas de uma balada pop, com arranjos melódicos de piano, violão e cordas, estrutura verso-refrão bem definida e produção polida voltada para o grande público.",58.10837531089783,MPB (Música Popular Brasileira),"Pop, Soft Rock, Bossa Nova Contemporânea, Jazz-Pop",95.0,"A faixa apresenta uma fusão característica da MPB contemporânea, unindo harmonias sofisticadas (com uso de extensões de acordes) a uma estrutura rítmica pop. A presença do violão de nylon com levada sincopada remete à Bossa Nova, enquanto a produção vocal e a instrumentação (piano e bateria suave) conferem um ar de Soft Rock e Adult Contemporary.",41.311922550201416
2024,Melim,Eu Feat. Você,mpb,107,107_Melim - Eu Feat. Você.mp3,ok,pop,95.0,"A faixa apresenta estrutura melódica acessível, produção polida com elementos acústicos e eletrônicos, e temática lírica leve, características típicas do pop contemporâneo brasileiro.",24.43415665626526,Nova MPB,"Pop Leve, Folk Pop, Indie Pop, Tropical Pop",95.0,"A faixa exemplifica a estética da 'Nova MPB', caracterizada pela fusão de instrumentos orgânicos (como o violão de aço e nylon) com texturas eletrônicas modernas e sintetizadores atmosféricos. A rítmica é baseada em um 'groove' de pop contemporâneo com síncopas sutis que remetem à música brasileira, enquanto a harmonia utiliza extensões jazzísticas típicas do gênero. A entrega vocal é melódica e suave, focada em uma temática solar e otimista, comum em artistas do cenário 'Pop Leve' atual.",33.19537305831909
2025,Os Barões Da Pisadinha,Basta você me ligar,forró,173,"173_Os Barões Da Pisadinha, Xand Avião - Basta Você Me Ligar - Ao Vivo.mp3",ok,forró,98.0,"A faixa apresenta a batida característica da pisadinha, uma vertente moderna do forró, com uso proeminente de teclados eletrônicos simulando o acordeão e ritmos sincopados. A presença de artistas como Barões da Pisadinha e Xand Avião confirma a classificação no gênero macro.",39.50796937942505,Forró,"Piseiro, Pisadinha, Forró Eletrônico",100.0,"A faixa é caracterizada pelo ritmo sincopado da pisadinha, executado com percussão eletrônica e acompanhamento de sanfona. A presença de sintetizadores e o estilo vocal melódico, mas rítmico, são típicos do Forró Eletrônico contemporâneo, especificamente o subgênero Piseiro, que se destaca pela batida marcada e arranjos minimalistas focados no teclado e na voz.",21.928263425827026
1985,Thiago Brava,Já convenci - Ao vivo,sertanejo,16,16_Thiago Brava - Já Convenci (DVD VIBEZINHA)(MP3_160K).mp3,ok,sertanejo,95.0,"A faixa apresenta elementos característicos do sertanejo universitário, como o uso proeminente da sanfona, violão acústico e uma temática lírica romântica e sentimental.",42.45224189758301,Sertanejo,"Sertanejo Universitário, Pop, Acústico, Arrocha",95.0,"A faixa é uma interpretação acústica de Sertanejo Universitário, caracterizada pelo uso predominante de violão e percussão suave (cajon), fugindo da instrumentação pesada de bandas de palco. A presença de um solo de saxofone adiciona uma camada de Pop/Jazz contemporâneo, enquanto a levada rítmica mantém a base do Arrocha. A estrutura lírica e a entrega vocal são típicas do gênero sertanejo moderno, focadas em temas românticos e cotidianos.",52.480589389801025
2020,Grupo Menos É Mais,Coração Partido (Corazón Partío) - Ao Vivo,pagode,83,83_Grupo Menos é Mais - Coração Partido (Clipe Oficial)(MP3_160K).mp3,ok,pagode,100.0,"A instrumentação é centrada no cavaquinho e percussão característica (pandeiro, surdo), com temática lírica romântica e estrutura rítmica típica do pagode contemporâneo.",38.7256121635437,Pagode,"Samba, Pagode Romântico, Samba-Pop",100.0,"A faixa é caracterizada pela rítmica sincopada do samba, com instrumentação baseada em violão de nylon e percussão tradicional (pandeiro e marcação). A estrutura melódica e a temática lírica centrada em desilusões amorosas e sentimentos ('coração partido') são elementos definidores do Pagode Romântico. A produção apresenta uma sonoridade limpa e comercial, típica do Samba-Pop contemporâneo.",40.969600677490234
2020,Os 3 do Nordeste,É proibido cochilar,forró,80,80_Trio Forrozão - É Proibido Cochilar (Forró Arrastapé)(MP3_160K).mp3,ok,forró,98.0,"A composição apresenta instrumentação típica (sanfona, triângulo e zabumba) com ritmo e temática lírica característicos do gênero.",74.2417345046997,Forró,"Xote, Baião, Forró Universitário, Pé-de-Serra",100.0,"A composição utiliza a instrumentação canônica do gênero: acordeão (sanfona), triângulo e zabumba. O ritmo é marcado por síncopas constantes e um compasso binário característico das danças nordestinas. A letra aborda temas tradicionais como o baile, o sanfoneiro e a cultura regional, enquanto a estrutura musical alterna entre versos cantados e solos instrumentais de acordeão com técnica de fole e ornamentação típica do estilo universitário e pé-de-serra.",30.573848485946655
2023,Rihanna,This is what you came for,pop,235,"235_Calvin Harris, Rihanna - This Is What You Came For.mp3",ok,pop,100.0,"A faixa apresenta uma produção eletrônica polida, batida dançante e melodias vocais cativantes, características centrais do gênero pop contemporâneo.",41.38554930686951,Electropop,"EDM, Dance-Pop, House, Tropical House",100.0,"A faixa apresenta uma estrutura rítmica 'four-on-the-floor' característica da House music, com um andamento aproximado de 124 BPM. A produção utiliza sintetizadores digitais, vocal chops processados e uma progressão harmônica acessível, fundindo a estética Pop com a energia das pistas de dança. Elementos de Tropical House são percebidos nos timbres de sintetizadores 'plucked', enquanto a estrutura de build-ups e drops define sua natureza EDM.",50.50640559196472
1992,Luiz Gonzaga,Pagode Russo,forró,179,179_Luiz Gonzaga - Pagode Russo.mp3,ok,forró,100.0,"A instrumentação é centrada na sanfona, triângulo e zabumba, com um ritmo sincopado característico do xote/baião. Embora a letra mencione 'pagode', a estrutura rítmica e melódica é tipicamente do forró nordestino.",23.507898569107056,Forró,"Baião, Galope, Forró Pé-de-Serra, Frevo-Sanfonado",100.0,"A faixa apresenta a instrumentação clássica do trio nordestino (sanfona, zabumba e triângulo) executando uma releitura de 'Pagode Russo'. O andamento é acelerado, caracterizando o 'Galope', com uma rítmica binária (2/4) e síncopas marcantes. A sanfona utiliza passagens escalares rápidas e ornamentações que remetem tanto ao virtuosismo do Frevo quanto à estética do Baião tradicional, mantendo a pulsação energética típica das festas de São João.",15.198156118392944
2025,Kesha,Tik tok,pop,237,237_Kesha - TiK ToK.mp3,ok,pop,100.0,"A faixa apresenta uma batida eletrônica dançante, uso intensivo de sintetizadores e um refrão melódico e repetitivo, características centrais do pop comercial contemporâneo.",36.755746603012085,Electropop,"Dance-pop, Synth-pop, Bubblegum Pop",100.0,"A faixa é caracterizada por uma produção eletrônica densa, utilizando sintetizadores digitais brilhantes e uma batida 'four-on-the-floor' típica da dance music comercial. A estrutura da canção foca em ganchos melódicos repetitivos e cativantes, com vocais processados por Auto-Tune que alternam entre o canto rítmico e melodias pop. A instrumentação e o arranjo são exemplares da estética electropop que dominou as paradas musicais no final da década de 2000.",40.948103189468384
2003,Turma do Pagode,Só um Pagode - Ao Vivo,pagode,85,85_Turma do Pagode - Só um Pagode (Ao Vivo)(MP3_160K).mp3,ok,pagode,100.0,"Presença de instrumentos característicos como cavaquinho e percussão (pandeiro, surdo), ritmo sincopado em 2/4 e estrutura vocal melódica com coro, além de menção explícita ao gênero na letra.",34.682931900024414,Pagode,"Pagode Romântico, Samba-Pagode, Pagode de Mesa",100.0,"A faixa é caracterizada pela instrumentação típica do samba urbano brasileiro, utilizando cavaquinho, pandeiro, surdo e violão de 7 cordas. O ritmo é estruturado em um compasso binário (2/4) com síncopas acentuadas. A harmonia e a melodia seguem o padrão do pagode romântico contemporâneo, com letras focadas em relacionamentos e um coro participativo que reforça a estética de 'roda de samba' ou 'pagode de mesa', embora com produção de estúdio/show ao vivo.",42.352070331573486
