ano,artista,faixa,genero1,id,arquivo,status,fechado_estilo,fechado_confianca,fechado_justificativa,tempo_fechado,aberto_estilo,aberto_subgeneros,aberto_confianca,aberto_justificativa,tempo_aberto
2021,"Mc Livinho, DJ TOPO",MTG PASSA PASSA PRA EU SARRAR,funk,41,41_MTG PASSA PASSA PRA EU SARRAR - MC LIVINHO_ DJ TOPO(MP3_160K).mp3,ok,forró,95.0,"A faixa apresenta a batida característica do piseiro, uma vertente moderna do forró, com uso proeminente de sintetizadores e um padrão rítmico sincopado típico do gênero.",27.113887786865234,Funk Carioca,"Funk Melody, Funk Pop, Eletrofunk",95.0,"A faixa é estruturada sobre a rítmica do 'tamborzão', característica fundamental do Funk Carioca. A produção utiliza sintetizadores modernos e uma abordagem vocal melódica, aproximando-a do Funk Melody e do Pop contemporâneo brasileiro. A batida eletrônica acentuada e o arranjo voltado para pistas de dança também permitem a classificação como Eletrofunk.",31.184033155441284
2010,Zeeba,Te dizer que sim,mpb,192,192_Zeeba - Te dizer que sim..mp3,ok,mpb,95.0,"A composição apresenta instrumentação acústica predominante, letras poéticas e melodia característica da Música Popular Brasileira contemporânea, com elementos de soft pop.",30.2936589717865,Pop Brasileiro,"Nova MPB, Pop Romântico, Indie Pop, Folk Pop",95.0,"A faixa apresenta características marcantes da 'Nova MPB', combinando o violão acústico com uma produção pop contemporânea. A estrutura melódica é acessível, com vocais limpos e expressivos, típicos do pop romântico nacional. A instrumentação equilibra elementos orgânicos e sutis camadas eletrônicas, resultando em uma sonoridade leve e comercial.",32.63874888420105
2017,"Luisa sonza, Demi Lovato",Penhasco 2,mpb,196,"196_Luísa Sonza, Demi Lovato - Penhasco2.mp3",ok,pop,95.0,"A faixa apresenta estrutura de balada contemporânea com produção polida, foco em melodias vocais acessíveis e arranjo que evolui de uma base acústica para um clímax com elementos de pop-rock, características típicas do pop nacional moderno.",32.75885462760925,Pop Rock Brasileiro,"Balada Pop, Soft Rock, MPB Contemporânea",95.0,"A faixa apresenta uma estrutura clássica de balada pop-rock, com início introspectivo ao piano evoluindo para um arranjo mais denso com guitarras e bateria. A interpretação vocal é emotiva e melódica, típica do gênero no Brasil, combinando elementos do rock suave com a sensibilidade da música popular brasileira contemporânea.",31.389161348342896
2024,"DG e Batidão Stronda, Mc Davi, J. Eskine, MC G15",Mãe Solteira,funk,37,37_MÃE SOLTEIRA - J.Eskine_ MC Davi_ MC G15_ DG e Batidão Stronda (GR6 Explode)(MP3_160K).mp3,ok,pagode,95.0,"A faixa apresenta instrumentação característica do pagode, como o cavaquinho e percussão rítmica (pandeiro e surdo), com estrutura melódica típica do gênero.",28.002989530563354,Funk Carioca,"Funk Ostentação, Pop Funk, Funk de Favela",98.0,"A faixa é construída sobre a célula rítmica do 'tamborzão', característica do Funk Carioca, com compasso quaternário e síncopas acentuadas. A instrumentação eletrônica foca em graves profundos e percussão programada. A lírica aborda temas de ascensão social e consumo de luxo, definindo o Funk Ostentação, enquanto a estrutura melódica do refrão e a produção polida indicam uma forte inclinação ao Pop Funk.",37.93933081626892
1994,"Boladin 211, MC Rick, MC Leozinho ZS, CAO$, Dj Lv Mdp","Chapa Máxima - feat. CAO$, Dj Lv Mdp",funk,42,42_MC Rick_ Boladin 211 e MC Leozinho ZS - CHAPA MAXIMA ( DJ LV MDP E CAOS NO BEAT )(MP3_160K).mp3,ok,funk,100.0,"A faixa apresenta a batida característica do funk brasileiro (tamborzão), com vocais rítmicos e repetitivos (estilo MC) e letras que abordam temas urbanos e de ostentação, típicos do gênero.",40.67489051818848,Funk Brasileiro,"Funk Ostentação, Funk Proibidão, Funk de Fluxo",95.0,"A faixa é caracterizada pela rítmica sincopada do funk, com batidas de 808 pesadas e loops melódicos repetitivos. A lírica foca em temas de ascensão social, poder e o cotidiano das comunidades, elementos centrais do Funk Ostentação e Proibidão. A produção sonora é moderna, com vocais agressivos e rítmicos típicos das produções contemporâneas de São Paulo e Rio de Janeiro.",26.44772505760193
2024,Suel,Vitamina C,pagode,98,"98_Suel, Grupo Menos É Mais - Vitamina C - Ao Vivo.mp3",ok,pagode,95.0,"Apresenta instrumentação e rítmica típicas do pagode, com uso proeminente de cavaquinho e percussão característica (pandeiro e surdo), em uma releitura de composição originalmente sertaneja.",26.152814626693726,Pagode,"Pagode Romântico, Samba-Pop, Samba",100.0,"A faixa é caracterizada por uma instrumentação típica do pagode contemporâneo, utilizando cavaquinho, violão e uma base percussiva centrada no pandeiro e surdo. A estrutura harmônica apresenta progressões de acordes com sétimas e nonas, comuns no gênero, enquanto a melodia e a letra seguem uma temática romântica com apelo pop. A presença de arranjos de metais e a dinâmica de 'chamada e resposta' com o público são marcas registradas das grandes produções de pagode ao vivo atuais.",43.994813442230225
2022,"MC Jvila, Mc Negão Original, DJ Dael",Pirocada Quente,funk,35,35_PIROCADA QUENTE - MC Negão original e MC Jvila (DJ Dael e DJ Guh Mix)(MP3_160K).mp3,ok,funk,100.0,"A faixa apresenta a batida característica do funk carioca (tamborzão), com vocais rítmicos e produção eletrônica baseada em loops e samples típicos do gênero.",44.4510383605957,Funk Carioca,"Funk Ostentação, Funk Pop, Tamborzão",100.0,"A faixa apresenta a célula rítmica característica do 'tamborzão', com compasso 4/4 e síncope marcante. A temática lírica foca em consumo, status social e sexualidade, elementos centrais do Funk Ostentação, enquanto a produção sonora e os ganchos melódicos conferem uma sonoridade comercial próxima ao Funk Pop.",25.79624032974243
2024,Carol Biazin,Menta com chá,mpb,191,191_Carol Biazin - MENTA COM CHÁ.mp3,ok,pop,95.0,"A faixa apresenta uma produção contemporânea com vocais melódicos, batida rítmica constante e uso de violão, características típicas do pop brasileiro atual.",44.39579963684082,Pop Urbano Brasileiro,"R&B Contemporâneo, Trap-Pop, MPB Contemporânea, Lo-fi Pop",95.0,"A faixa apresenta uma fusão característica da música pop brasileira atual, combinando o dedilhado rítmico do violão (herança da MPB) com uma produção eletrônica baseada em batidas de Trap (hi-hats rápidos e graves profundos). O fraseado vocal é melódico e suave, típico do R&B, com uma estrutura de composição focada em refrões chiclete e uma atmosfera relaxada (chill vibe).",27.5325186252594
2024,Matuê,Reza do Milhão,hip-hop,125,125_Matuê - Reza do Milhão.mp3,ok,hip-hop,95.0,"A faixa apresenta vocais rítmicos e rimados sobre uma base instrumental com batidas marcadas e graves profundos, características centrais do hip-hop moderno.",30.125134229660034,Trap Brasileiro,"Melodic Trap, Trap Ostentação, Hip Hop Contemporâneo",98.0,"A faixa é construída sobre uma base rítmica característica do Trap, com hi-hats em subdivisões rápidas e o uso proeminente de sub-graves (808s). A entrega vocal utiliza autotune de forma estética para criar linhas melódicas fluidas, definindo o subgênero Melodic Trap. Liricamente, a composição foca em temas de superação, sucesso financeiro e autoconfiança, elementos centrais do Trap Ostentação no cenário urbano brasileiro.",42.383450984954834
2022,Matuê,Crack com Mussilon,hip-hop,123,123_Matuê - Crack com Mussilon.mp3,ok,hip-hop,95.0,"A faixa apresenta elementos característicos do trap, um subgênero do hip-hop, incluindo batidas com graves profundos (808s), hi-hats rápidos e um flow vocal rítmico com uso de autotune.",43.77420449256897,Trap,"Trap Brasileiro, Melodic Trap, Cloud Rap",95.0,"A faixa é estruturada sobre uma base rítmica característica do Trap, com graves 808 profundos e hi-hats em subdivisões rápidas. A performance vocal utiliza Auto-Tune de forma estética, alternando entre o rap e linhas melódicas suaves. A textura sonora é enriquecida por sintetizadores atmosféricos e etéreos, típicos do Cloud Rap, enquanto a lírica e o flow situam a obra no cenário do Trap Brasileiro contemporâneo.",31.632691621780396
2009,"Kew, Dj LK da Escócia",Descer,funk,33,33_Kew - Descer  (DJ Lk da Escócia)(MP3_160K).mp3,ok,funk,95.0,"A faixa apresenta a batida característica do funk carioca (tamborzão), com vocais rítmicos e produção eletrônica voltada para a dança.",47.283201694488525,Funk Carioca,"Funk Pop, Funk 150 BPM, Eletrofunk",95.0,"A faixa é construída sobre a base rítmica do 'tamborzão', característica fundamental do Funk Carioca. A produção apresenta um acabamento comercial com ganchos melódicos e uso de sintetizadores, alinhando-se ao Funk Pop. O andamento acelerado e a síncope percussiva remetem à estética do 150 BPM, enquanto a textura sonora eletrônica justifica a classificação como Eletrofunk.",31.613648176193237
2020,"PEDRO SAMPAIO, Marina Sena",ESCADA DO PRÉDIO,funk,39,39_PEDRO SAMPAIO_ Marina Sena - Escada Do Prédio (Lyrics)(MP3_160K).mp3,ok,pop,95.0,"A faixa apresenta uma produção eletrônica polida com estrutura de verso e refrão bem definida, característica do pop contemporâneo brasileiro, integrando elementos rítmicos do funk de forma melódica e comercial.",40.69894051551819,Funk Pop,"Funk Carioca, Pop, R&B Contemporâneo, Electro-pop",95.0,"A faixa apresenta uma fusão característica entre a base rítmica do Funk Carioca e a estrutura melódica do Pop. A produção utiliza sintetizadores modernos e uma batida eletrônica polida, típica do cenário mainstream brasileiro. A presença de um solo de saxofone e vocais melódicos adiciona nuances de R&B, enquanto a cadência rítmica mantém a essência do funk.",37.65539336204529
2024,Os garotin,Zero a cem,mpb,190,"190_Os Garotin, Anchietx - Zero a Cem.mp3",ok,pop,95.0,"A faixa apresenta produção polida, vocais melódicos com refrão chiclete e uma mistura de instrumentação acústica com batidas eletrônicas, característica do pop contemporâneo.",24.75415015220642,Pop-Funk,"Soul Brasileiro, R&B Contemporâneo, Groove, MPB Contemporânea",95.0,"A faixa é construída sobre uma base rítmica sincopada característica do funk, com um baixo 'groovado' e bateria estalada. A instrumentação inclui arranjos de metais (metais de sopro) que remetem ao soul clássico, enquanto a produção vocal e a estrutura harmônica, utilizando acordes com extensões (7ªs e 9ªs), inserem a obra no contexto do pop moderno brasileiro. A entrega vocal alterna entre o canto melódico e o fraseado rítmico, demonstrando influências claras de artistas como Jota Quest e Ed Motta.",54.14128065109253
2024,"Luísa Sonza, KayBlack",Sagrado Profano,hip-hop,129,"129_Luísa Sonza, KayBlack - Sagrado Profano.mp3",ok,pop,95.0,"A faixa apresenta uma produção polida com fusão de elementos acústicos e eletrônicos, estrutura rítmica constante e vocais melódicos acessíveis, características centrais do pop contemporâneo brasileiro.",28.393781900405884,Pop Nacional,"Trap-Pop, R&B Contemporâneo, Acoustic Pop",95.0,"A faixa apresenta uma fusão característica do pop brasileiro atual, unindo uma base harmônica de violão acústico a uma seção rítmica eletrônica baseada no Trap, com hi-hats em subdivisões rápidas e sub-graves 808. A performance vocal utiliza métricas do rap em passagens melódicas, definindo uma estética de R&B contemporâneo com forte apelo comercial.",50.247458934783936
2024,"Boladin 211, Dejinha, MC Rick",Penélope Charmosa 2,funk,32,32_Penélope Charmosa 2 - Boladin 211_ Mc Rick_ Dejinha ( DJ all4ddin )(MP3_160K).mp3,ok,funk,100.0,"A faixa apresenta a batida característica do 'tamborzão', vocais repetitivos com gírias urbanas e produção eletrônica típica do funk carioca.",30.803352117538452,Funk Brasileiro,"Funk 150 BPM, Funk Carioca, Eletrofunk",100.0,"A faixa é estruturada sobre a batida característica do 'tamborzão', apresentando uma cadência acelerada e agressiva típica do subgênero 150 BPM. A produção utiliza loops eletrônicos repetitivos, samples de voz e efeitos sonoros comuns em bailes funk. A lírica e a métrica vocal seguem o padrão do gênero, com foco em gírias urbanas brasileiras e temas festivos, consolidando sua identidade dentro do Funk contemporâneo.",48.985071659088135
2018,Marina Sena ,Por Supuesto,mpb,197,197_Marina Sena - Por Supuesto.mp3,ok,mpb,95.0,"A faixa apresenta instrumentação acústica, vocais melódicos com letras poéticas e uma estrutura harmônica sofisticada, características típicas da Música Popular Brasileira contemporânea.",35.69654035568237,Pop Alternativo Brasileiro,"Indie Pop, Nova MPB, Funk-Pop, Tropicalismo Contemporâneo",92.0,"A faixa apresenta uma fusão de elementos rítmicos brasileiros com a estética do pop alternativo global. Destacam-se as guitarras sincopadas, o uso de harmonias jazzísticas típicas da MPB e uma produção que equilibra instrumentos orgânicos com texturas eletrônicas. A entrega vocal é melódica e expressiva, característica da nova geração da música popular brasileira.",43.948888540267944
2025,"Chefin, LB Único",Se Essa Bunda For Uma Empresa,funk,36,36_Chefin - Se essa bunda for uma empresa (prod. LB Único)(MP3_160K).mp3,ok,funk,98.0,"A faixa apresenta a batida característica do funk brasileiro (tamborzão), com vocais rítmicos e produção baseada em batidas eletrônicas e graves acentuados.",39.60887837409973,Trap Funk,"Funk Carioca, Trap, Funk Ostentação, Baile Funk",95.0,"A faixa apresenta uma fusão clara entre a batida característica do Funk Carioca (tamborzão) e elementos de produção do Trap, como graves profundos (808s), hi-hats rápidos e uma atmosfera mais densa. A lírica e o flow do vocalista também remetem ao Funk Ostentação, mantendo a rítmica sincopada típica do gênero brasileiro.",42.1611909866333
2015,Ludmilla,Todo mundo louco,hip-hop,126,"126_LUDMILLA, Capo Plaza, Tropkillaz, Ape Drums - Todo mundo Louco.mp3",ok,funk,98.0,"A faixa apresenta a batida característica do 'tamborzão' do funk carioca, com letras que fazem referência direta ao gênero e uma estrutura rítmica voltada para a dança.",56.56355834007263,Funk Carioca,"Funk Pop, Urban Latino, Global Bass, Funk 150 BPM",100.0,"A faixa é construída sobre a célula rítmica sincopada do 'tamborzão', característica fundamental do Funk Carioca. A produção apresenta uma estética 'Funk Pop' de alta fidelidade, com sub-graves profundos e sintetizadores minimalistas. A colaboração bilíngue (português e italiano) e a estrutura de refrão chiclete inserem a obra no contexto do Global Bass, fundindo a batida periférica brasileira com elementos do trap e do pop urbano internacional.",25.245471715927124
2024,Exaltasamba,Gamei,pagode,189,189_Exaltasamba - Gamei.mp3,ok,pagode,100.0,"A faixa apresenta instrumentação característica do pagode, como o cavaquinho e percussão típica (pandeiro, surdo), além de uma estrutura rítmica e melódica clássica do gênero.",29.39582085609436,Pagode,"Pagode Romântico, Samba-Pop, Samba",100.0,"A faixa exibe as características fundamentais do pagode romântico brasileiro, com uma estrutura rítmica baseada no samba, mas com uma produção voltada ao pop. A instrumentação combina o violão de nylon com uma percussão vibrante e arranjos de metais, típicos das bandas de pagode dos anos 90 e 2000. A interpretação vocal é melódica e expressiva, focada em um refrão 'chiclete' e temática sentimental.",52.7432005405426
2024,Kell Smith,Era uma vez,mpb,198,198_Kell Smith - Era uma Vez.mp3,ok,mpb,95.0,"A composição apresenta arranjo predominantemente acústico com foco no violão, letras poéticas e melódicas, e uma interpretação vocal característica da Música Popular Brasileira contemporânea.",38.81392312049866,Nova MPB,"Pop Folk, Soft Pop, Indie Pop",95.0,"A faixa apresenta características marcantes da Nova MPB, como a instrumentação centrada no violão acústico, letras introspectivas e nostálgicas, e uma produção limpa que funde elementos do Pop e do Folk. A estrutura melódica é acessível, com um refrão cativante e vocais expressivos que priorizam a narrativa lírica.",42.7584924697876
2021,Baco Exu do Blues,20 Ligações,hip-hop,133,133_Baco Exu do Blues - 20 Ligações.mp3,ok,pop,95.0,"A faixa apresenta uma estrutura melódica acessível, produção contemporânea com elementos eletrônicos e orgânicos, e uma cadência rítmica característica do pop mainstream brasileiro.",37.49420976638794,MPB Contemporânea,"Bossa Nova, R&B, Neo-Soul, Hip-Hop, Lo-fi",95.0,"A faixa apresenta uma fusão característica da música brasileira moderna, unindo a rítmica e harmonia do violão de nylon (Bossa Nova) com batidas eletrônicas de influência Hip-Hop e R&B. A interpretação vocal é melódica e relaxada, típica do Neo-Soul, enquanto a progressão harmônica utiliza acordes com extensões jazzísticas, definindo a estética da 'Nova MPB'.",47.354294538497925
2021,Gamadinho,Instinto,pagode,99,99_Gamadinho - Instinto.mp3,ok,pagode,95.0,"A faixa apresenta rítmica característica do samba/pagode, com uso de violão e percussão (pandeiro), além de temática romântica e interpretação vocal típica do gênero.",36.72822046279907,Sertanejo Universitário,"Pop Rock, Pop Romântico, Folk Pop",95.0,"A faixa apresenta uma fusão característica do Sertanejo Universitário com elementos do Pop Rock contemporâneo. A instrumentação é centrada no violão de aço com dedilhados e batidas rítmicas, acompanhada por uma cozinha (baixo e bateria) de padrão pop. A estrutura harmônica é simples e direta, típica de baladas românticas, enquanto a interpretação vocal utiliza ornamentos e inflexões comuns ao gênero sertanejo moderno, mas com uma produção polida voltada para o mercado mainstream.",52.14411997795105
2024,Emicida ,Hoje cedo,hip-hop,132,"132_Emicida, Pitty - Hoje Cedo.mp3",ok,hip-hop,95.0,"A faixa é uma releitura acústica de 'Hoje Cedo', do rapper Emicida. A estrutura é definida por versos rimados com métrica de rap e entrega vocal rítmica, elementos fundamentais do hip-hop.",41.82323384284973,Hip-hop Acústico,"Rap, Beatbox, Pop Rap, MPB Contemporânea",98.0,"A performance é uma releitura da canção 'Hoje Cedo' (Emicida), utilizando uma instrumentação minimalista composta por violão e beatbox. A estrutura alterna entre o 'flow' rítmico do rap nos versos e um refrão melódico, característica marcante do rap nacional moderno que flerta com a MPB. A ausência de elementos eletrônicos e a ênfase na percussão vocal definem a estética acústica e orgânica da faixa.",46.034029722213745
2025,"Mc Vitão, DENNIS",Olha o Gás - Dennis Remix,funk,45,45_Mc Vitão x Sam - Olha o Gás (DENNIS REMIX)(MP3_160K).mp3,ok,funk,100.0,"A faixa apresenta a batida característica do funk carioca (tamborzão), com vocais rítmicos e letras focadas em coreografias, elementos típicos do gênero.",52.15945291519165,Funk Carioca,"Funk 150 BPM, Funk de Passinho, Meme Song",98.0,"A faixa apresenta características marcantes do Funk Carioca contemporâneo, como o andamento acelerado (próximo a 150 BPM), batida sincopada com graves acentuados e vocais rítmicos típicos de MCs. A letra é coreográfica, instruindo passos de dança, o que a enquadra no subgênero 'passinho'. Além disso, utiliza um sample viral ('Oh Gás'), caracterizando-a como uma música de apelo mediático e viral.",36.88978886604309
1996,"Xamã, Agnes Nunes, Neo Beats, Bagua Records",Escorpião,hip-hop,131,"131_Xamã, Bagua Records, Agnes Nunes, Neo Beats - Escorpião.mp3",ok,hip-hop,95.0,"A faixa apresenta rimas rítmicas (rap), batida sincopada com graves acentuados e estrutura característica do hip-hop contemporâneo.",43.78610420227051,Trap,"R&B, Trap-Soul, Hip-Hop, Trap Brasileiro",95.0,"A faixa apresenta elementos característicos do trap, como batidas programadas com hi-hats rápidos e graves 808 profundos, combinados com uma entrega vocal melódica e atmosférica típica do R&B contemporâneo e do Trap-Soul. A produção utiliza sintetizadores etéreos e uma estrutura rítmica sincopada, alinhando-se à estética do trap melódico brasileiro.",45.71034789085388
2005,Teto,Fashion,hip-hop,127,127_Teto - Fashion.mp3,ok,hip-hop,95.0,"A faixa apresenta elementos característicos do trap, um subgênero do hip-hop, como o uso de graves profundos (808s), hi-hats rápidos e uma entrega vocal rítmica e melódica (flow).",56.93197059631348,Trap Brasileiro,"Melodic Trap, Emo Trap, Cloud Rap",98.0,"A faixa é construída sobre uma base rítmica característica do Trap, com sub-graves (808s) profundos, hi-hats rápidos em subdivisões de colcheias e fusas, e uma caixa (snare) marcada no tempo fraco. A performance vocal utiliza o Auto-Tune de forma estética e melódica, fundindo o rap com linhas vocais cantadas, o que define o Melodic Trap. A atmosfera etérea dos sintetizadores e a temática que mistura ostentação com introspecção emocional são pilares do Cloud Rap e do Emo Trap contemporâneo.",34.778035402297974
2020,"Papatinho, Anitta, Dfideliz, BIN",Tá com o Papato (feat. BIN),hip-hop,122,"122_Papatinho, Anitta, Dfideliz, BIN - Tá com o Papato (feat. BIN).mp3",ok,hip-hop,98.0,"A faixa apresenta elementos característicos do trap, um subgênero do hip-hop, como batidas graves (808), hi-hats rápidos e rimas rítmicas faladas (rap).",56.258519411087036,Trap,"Trap Brasileiro, Funk Trap, Pop Rap",100.0,"A faixa apresenta a estrutura rítmica clássica do Trap, com graves 808 proeminentes, hi-hats em tercinas e uma cadência vocal agressiva. A fusão com elementos do Funk Carioca, evidenciada pelo balanço rítmico e pela participação de artistas do gênero, caracteriza o Funk Trap. A produção polida de Papatinho e a estrutura voltada para o mainstream a classificam também como Pop Rap.",36.83775019645691
2020,Liniker,CAJU,mpb,120,120_Liniker - CAJU.mp3,ok,pop,95.0,"A faixa apresenta estrutura melódica característica do pop contemporâneo brasileiro, com produção limpa, foco nos vocais e letras sentimentais, mesclando elementos acústicos e eletrônicos.",50.935359477996826,Nova MPB,"Pop Brasileiro, Bossa Nova, Indie Pop, Hip-hop",95.0,"A faixa exemplifica a estética da Nova MPB ao fundir elementos tradicionais, como o violão com levada de Bossa Nova, a uma produção pop contemporânea. O fraseado vocal apresenta uma métrica rítmica influenciada pelo hip-hop, enquanto o refrão foca na melodia expansiva característica do pop. A instrumentação equilibra timbres orgânicos e texturas eletrônicas modernas.",44.11462354660034
2021,MC Cabelinho,EU TE AVISEI,hip-hop,128,"128_MC Cabelinho, Dallass - EU TE AVISEI.mp3",ok,hip-hop,95.0,"A faixa apresenta elementos característicos do trap, um subgênero do hip-hop, como batidas com graves profundos (808s), hi-hats rápidos e sincopados, além de um flow vocal rítmico e melódico.",57.95520305633545,Trap Brasileiro,"Melodic Trap, Pop Trap, Hip Hop",100.0,"A faixa é construída sobre uma base rítmica de Trap, caracterizada pelo uso proeminente de sub-graves (808), hi-hats em semicolcheias e fusas (triplets) e uma caixa (snare) seca e estalada. O uso estético de Auto-Tune nas vozes, aliado a um flow que transita entre o rap e o canto melódico, classifica a obra como Melodic Trap. A estrutura de produção é voltada para o consumo comercial, com refrões ganchosos e temática de ascensão social, típica do cenário Pop Trap nacional.",37.95313477516174
2023,"Henrique & Diego, Matheus & Kauan",Ciumento Eu (feat. Matheus & Kauan) - Ao Vivo,sertanejo,3,3_Henrique _ Diego - Ciumento Eu ft. Matheus _ Kauan(MP3_160K).mp3,ok,sertanejo,95.0,"A música apresenta características típicas do sertanejo universitário, como o uso de violão, bateria e uma temática lírica romântica/sentimental, além do estilo vocal característico do gênero.",45.58849215507507,Sertanejo Universitário,"Sertanejo Pop, Pop Rock Brasileiro, Arrocha",100.0,"A faixa apresenta a instrumentação característica do sertanejo contemporâneo, unindo o violão de aço a guitarras elétricas com timbres de pop/rock. A estrutura harmônica é simples e direta, focada em um refrão memorável e letras de temática romântica/cotidiana. O ritmo é acelerado, com uma levada que flerta com o pop-rock nacional, mantendo a dicção e os ornamentos vocais típicos do gênero sertanejo universitário.",50.764238357543945
2024,Prettos,O show tem que continuar,pagode,187,"187_Prettos, Sombrinha, Magnu Sousá, Maurilio de Oliveira - O Show Tem Que Continuar - Ao Vivo.mp3",ok,pagode,100.0,"A instrumentação é centrada no cavaquinho e pandeiro, com ritmos de samba característicos do pagode. A estrutura melódica e o coro participativo são elementos típicos de apresentações ao vivo deste gênero.",32.01453733444214,Pagode,"Samba de Raiz, Partido Alto, Samba-Pagode",100.0,"A faixa apresenta a instrumentação canônica do gênero, centrada no cavaquinho, violão e uma base percussiva orgânica composta por pandeiro, tantã e surdo. A rítmica é fundamentada no samba sincopado em compasso binário (2/4), com a presença marcante de coros responsivos e uma atmosfera de 'roda de samba' ao vivo. A estrutura melódica e a temática lírica são características do pagode contemporâneo, que une a tradição do samba de raiz com uma produção voltada para grandes públicos.",65.78710699081421
